,review,score
1085,친구추천으로 샘플 써보고 주문합니다..친구추천으로 샘플 써보고 주문합니다..친구추천으로 샘플 써보고 주문합니다..,5
1086,구매해서써보고다시재구매하네요친구한테선물해줬어요좋아하겠죠?^^저역시기대반설렘반으로샀는데사용해보니역시~좋더군요,5
1087,아주좋은듯요 만족만족 ㅎㅎ아주좋은듯요 만족만족 ㅎㅎ아주좋은듯요 만족만족 ㅎㅎ,5
1088,좋아요 가격대비 만족합니다. 쿠폰 사용해서 다른 곳 보다 저렴하게 구매했습니다~,5
1089,사은품도 다 잘 왔구요~이것저것 많이 챙겨주신거 같아서 좋습니다 ㅋㅋ원래 쓰던거라 적립금으로 저렴하게 잘 구입했어요~,5
1090,계속 쓰고있는 제품이므로 저랑 잘 맞아서 잘 쓰고 있어요^^,5
1091,샘플 써보고 골랐어요 사실은 피부과에서 BB크림을 샀는데 그래도 발림성도 그렇고 유분기도 적고 트러블도 덜해서 월래는한스킨을 썼다가 이걸로 바꿨어요 한스킨이 유분기가 더한거 같아요 트러블이 조금 있는것 같아 샘플써보니 트러블이 제일 적었어요 더써봐야 하겠지만 만족합니다,5
1092,"깜짝할인으로 가격도 저렴하게 구매했고, 같이온 수분크림 사은품도 마음에 듭니다",5
1093,비비하면 이만한 상품은 없는듯해요..지성인 피부엔 짱ㅋㅋㅋ,5
1094,계속 쓰던 비비크림이라 또 주문했어요다른곳보다 가격도 제일 저렴하고 사은품도 빵빵하게 주셔서 더 좋네요~예쁜 슬리퍼에 수분크림까지 아주 잘 쓰겠습니다.,5
1095,"아직사용전이라 모르겠으나,,수많은 상품평을 믿고 구매해봤어요기대만빵입니다.",5
1096,"기다려왔던 비비라 말할 수 있을까요?발림성, 색상, 제품의 질 모두 우수합니다. ",5
1097,배송도 빠르고 물건도 좋아요 배송도 빠르고 물건도 좋아요 ,5
1098,내가 원하는 만큼 잘 커버하고 얇게 발리고...몇년동안 h스킨쓰다가 바꿔봤는데 너무 괜찮아요!!!,5
1099,"배송도 빨랐구요 물건두 넘 맘에 들어요샘플 써보구 좋아서 신청한건데너무 좋음-지성인 제 피부에도 잘 맞고커버두 잘되구아무튼 또 구매하고 싶네요^,^",5
1100,지금 저는 쓰고 있는데 저꺼 써보고 사람들이 시켜달라고 난리 입니다 넘넘 좋은거 같아요^^,5
1101,블랙라벨만 써봤는데 실버라벨도 커버력도 괜찮고 색상도 밝네요블랙라벨만 써봤는데 실버라벨도 커버력도 괜찮고 색상도 밝네요블랙라벨만 써봤는데 실버라벨도 커버력도 괜찮고 색상도 밝네요블랙라벨만 써봤는데 실버라벨도 커버력도 괜찮고 색상도 밝네요블랙라벨만 써봤는데 실버라벨도 커버력도 괜찮고 색상도 밝네요,5
1102,비비크림 넘 맘에들러요~~ㅎㅎ색상 발림성 모두 만족해요~~,5
1103,며칠 전에 구입했는데 오늘 이멜이 왔네요 세일한다고 ㅠㅠ비비크림 브랜드 너무 많은데 이거 괜찮아요,5
1104,회사동료언니한테 한번 권했다가 이제는 항상 공동구매를 하게 된 비비~,5
1105,ㅠㅠ 제가 파운데이션을 쓰다가 가격이 조금 부담되서 비비크림 찾고 있었는데요(아직 학생임..)비비크림 찾다가 닥터자르트 상품평이 너무 좋고 ㅋㅋㅋ 구성도 너무 좋아서 구매했습니다.오 근데너무 좋아요!!! 제가 원래 MA*쓰다가 바꾼건데요 피부톤이 진짜 이뿌게 되더라고용원래쓰던건 너무 매트... 그리고 다크닝없다하지만 전 있더라고요근데 이비비는 다크닝이아니고 지워지려면 그냥 지워지는거같아요다시 재 화장해도 너무 이뿌게 발려요 추천!!! 이에요 가격도 저렴해서!~!,5
1106,실버라벨비비 이것만큼 괜찮은게 없어요유분도 적고 조금만 발라도 화사하고 커버력도 확실하구요..이번에 샀을때 샘플이 많아서 좋았어요 ㅎㅎ,5
1107,예전에 쓰던건데 다른 비비크림 선물받아 쓰다가 너무 번들거려서 다시 닥터자르트를 선택하게 되었습니다.뽀송뽀송하고 커버력도 좋아서 여름에 쓰기 딱!!,5
1108,한 6시간 후 개기름 지는거 말고는 조아요 ㅎㅎ커버력이 굿 굿 ,5
1109,BB하고 파우더하고 구입했는데 지금까진 좋은거같습니다.한번테스트해보느라고 약간씩발라보았는데 괜찮은거같습니다.쎔플도 많이주시고 ,5
1110,배송도 빠르고.. 품질도 좋고 전부터 사용하던 제품이라. 맘에 듭니다.,5
1111,소문듣고 함 써볼려구요맘에 들면 좋겠어요,5
1112,BB크림은 처음 사용하는거라 솔직히 어떤게 좋은 건지 잘 모르겠네요.상품평이 좋길래 구매했습니다.가격 저렴한것 같고 샘플도 이것저것 챙겨주시고배송도 무지 빠르네요.처음 발라봤는데 밀착력은 좋은것 같은데 커버력은 잘 모르겠어요.그럭저럭 괜찮은 제품 같습니다.,5
1113,지난번엔 블랙라벨 사용하다가 실버를 구입했습니다..블랙에 비해서 커버가 잘되네요~^^사은품도 항상 H몰이 젤 푸짐한거 같아요~,5
1114,좋아요...ㅎㅎ 좋아요...ㅎㅎ 좋아요...ㅎㅎ 좋아요...ㅎㅎ 좋아요...ㅎㅎ 좋아요...ㅎㅎ 좋아요...ㅎㅎ 좋아요...ㅎㅎ 좋아요...ㅎㅎ 좋아요...ㅎㅎ 좋아요...ㅎㅎ 좋아요...ㅎㅎ 좋아요...ㅎㅎ 좋아요...ㅎㅎ 좋아요...ㅎㅎ 좋아요...ㅎㅎ 좋아요...ㅎㅎ 좋아요...ㅎㅎ 좋아요...ㅎㅎ 좋아요...ㅎㅎ 좋아요...ㅎㅎ 좋아요...ㅎㅎ 좋아요...ㅎㅎ 좋아요...ㅎㅎ 좋아요...ㅎㅎ 좋아요...ㅎㅎ 좋아요...ㅎㅎ 좋아요...ㅎㅎ 좋아요...ㅎㅎ 좋아요...ㅎㅎ 좋아요...ㅎㅎ 좋아요...ㅎㅎ 좋아요...ㅎㅎ 좋아요...ㅎㅎ ,5
1115,한번 써보고 또 구입했어여 샘플도 많고 배송도 빠르고 좋아요,5
1116,샘플도 푸짐하고 마음에 들어요. 블랙보다 색상톤이 밝아서 마음에 들어요. 좀 번들거리지만 괜찮아요 ^^ 배송 엄청 빨라요.,5
1117,피부가 민감성이라 고민을 많이 했는데 밀착이 잘돼서 너무 좋습니다~~ 다음에도 또 구매할겁니다~~ ㅎㅎ,5
1118,쓰던 비비크림이예요 ~!커버력도 있고 매끈하고 너무 좋아요 ~!!!,5
1119,비비 실망없이 좋아요다만 너무 뻑뻑하고 약간 어두운감이있지만샤이니베이스랑 섞어쓰면 촉촉하고 윤기도 나보이고 좋네요주근깨심한데 잘 가려줘서 좋아용재구매의사 100%근데 샘플은 뭐 그저그래여,5
1120,"역시 소문대로 커버력도 좋구요...얇게 발라도 잘 가려지고, 발림성도 좋고 자외선 차단도 되서 좋아요...",5
1121,블렉라벨이랑고민햇는데이게더조은거가태용샘플도많이보내주시고감사합니당^.^,5
1122,우와~ 비비크림 하나에 사은품이 엄청 많네요. 고맙습니다.,5
1123,부드럽고 잘 발라지며 동시에 커버럭도 좋네요사실 상품평이 좋아서 샀는데 기대 이상이예요,5
1124,비비 크림 좋습니다~~~~~~~~~~` FJKDSJFLDSJFJLSDLFJKLSDFJKLDSJLFKLSEFWEFWE ,5
1125,"저는 복합성 피부인데요여름에 바르기 좋은 것 같네요저한테 매트한 편이긴한데 여름이라 그냥 쓸 만해요다만 복합성 피부는 바르기 전에 기초공사를 잘하셔야 해요건성에게는 비추에요. 지성은 강추...자극적이지도않고 색상도 괜찮아요너무 어둡지도 밝지도 않고.. 비비크림치고 시멘트빛이 안돌아서 좋아요이거 다 쓰면 블랙라벨도 한번 써보려구요커버력도 좋은 편이구요단점이라면 좀뻑뻑하다는거?아 참 사은품으로 온워터슈어젤(수분크림) 좋더라구요 결론적으로 저렴한 가격에 잘산 것 같아서 좋아요장점 : 커버력이 좋다, 비비치고 회색빛이 덜 돈다, 가격이 저렴하다단점 : 매트하다, 뻑뻑하다",5
1126,원래 파운데이션만 썼는데 귀찮기도 하고 해서 비비 사봤어요어둡다는 말도 있는데 전 밝은 것 같은데..ㅋㅋ21호에 가까운 21호와 23호 사이의 노란 피부인데저한테 약간 밝아서 목하고 약간 차이 나요 ㅋㅋ그래도 선크림 바르고 이거 하나만 바르면 되서 편하고예전에 작은 트러블들이 많이 났어서 붉은 자국들이 있는데그정도는 다 커버되네요. 기미는 커버 안되요얇게 잘 발리고 생각보다 다크닝도 적고 오래 가네요지성이라 오후되면 금방 번들거리지만 티슈로 살짝 찍어주면극뽁?ㅋㅋㅋ암튼 맘에 들어요다 쓰면 재구매 할 것 같아요.,5
1127,'좋아요 첨 써보는데 발림성 커버력 다 좋아요,5
1128,"배송도 빠르네요,,ㅋㅋ블랙라벨만 3통째쓰다가..커버력을 원해서 샀는데..좋네요,,진작에 실버라벨로 바꿀껄,,ㅋㅋㅋ완전만족합니다.",5
1129,빠른 배송 감사합니다.. 늘 쓰던거라 ^&^~,5
1130,친구가 이제품만 사용해서생일선물해줬어요저두 샘플써봤는데 얼굴이 완전 3D 로 빛나던데요??ㅋㅋ저두 닥터자르트 팬되었어요~~ ㅋ,5
1131, 첨가하신 상품 [10%쿠폰+2700원적립금 ★아크넥스 클렌징바 정품+대용량키트4종+9종 사은품!★]닥터자르트 실버라벨 리쥬비네이팅 BB크림   ,5
1132,3일째되는 날 배송받았네요샘플도 골고루 들어있어서 기분좋게 사용할 것 같아요,5
1133,아직 쓰고있는 이지함비비가 있는데 상품평보고 질럿음.제발 내 얼굴에 맞기를,5
1134,배송두 빠르고 샘플도 넘많아서아주 만족합니다...제품 아직 안써서 좋은 진 몰겠네요,5
1135,지금까지 계속 사용해 오돈거라 역시 좋아요. 촉감도 좋고 만족해요. 감사합니다.,5
1136,너무 갖고싶던거라서 조금의 망설임도 없이 주문을 했는데요.빠른배송이 너무너무 맘에 듭니다 ^^샘플도 많이 와서 기분도 좋구요 !이거 바르고 피부미인되야 겠어요 !ㅋㅋㅋㅋㅋ,5
1137,닥터자르트 항상 쓰던거라 Hmall이 저렴하길래 구매 했는데사은품도 다른곳보다 훨~~씬 많이 챙겨주시고 적립금까지 주셔서 상품 구매 대만족이예요^^,5
1138,얇게 발리는게 정말 좋와요~ 샘플도 넉넉하게 주셔서 이것저것 써봤는데 다른제품도 좋더라구요~ ,5
1139,좋아여 ~ 사은품도많고사람들이많이쓴다고해서사용해봣는데쫌양이적어요 그래도배송도빠르고좋아여 ~ ,5
1140,역시 비비는 닥터자르트이지요^^벌써 3개째 구입해서 쓰고 있어요저는 매트한 비비크림을 선호하는데여닥터자르트는 바르는 즉시 묻어나오지 않아서 젤 좋아요,5
1141,비비크립은 닥터자르트만 쓰고 있습니다. 이번에 선물용으로 몇세트 샀는데사은품도 많이 주시고 너무너무 만족하네요! 번창하세요! ,5
1142,"여기저기 블로그 찾아보다 좋다그래서 주문했는데 1+1이었네요 샘플도 많이 주셔서 감사하긴한데 성분이 조금 의심스런...뭐..가격,사은품에 만족하고 걍 사용해야 할듯",5
1143,추천받아서 처음으로 구매했습니다.배송도 어제 해서 오늘 바로 받았구요 발라보니 좋은것 같습니다.,5
1144,친구가 추천해서 쓰게되었는데 잔향이 넘 좋아요 ^^ 다쓰고 재구매 할께용^^,5
1145,생각보다 용기가 작네요... 그래도 양이 적지는 않구요. 헤프게 쓰지 않는다면 1년은 거뜬히 쓸 거 같습니다. 샘플이 엄청 많이 와서 깜놀 했어요. 근데 저는 샘플 쓰면 트러블 나는 피부라 쓰지도 못하는 건데... 아깝지만 친구줘야겠어요. 한번 써봤는데 나쁘진 않더라구요. 제가 조금 까만 편인데 제 피부색에 맞고... 좀 하야신 분들은 어두울수도... 그리고 제조일자도 제가 제대로 읽은 게 맞다면 11년 4월 25일로 돼 있네요.용기가 좀 헤프게 많이 나오게 돼 있어요. 그것 빼고는 대체적으로 만족합니다. ,5
1146,끈적이지 않아서 좋아요커버력도 좋구요사은품 많이 챙겨 주셔서 감사합니다.,5
1147,엄마 선물로 사드린건데.... 아직 구경도 못했네요!!엄마께 물어보고 사용평 올릴게요^^,5
1148,좋아요!좋아요!좋아요!좋아요!좋아요!좋아요!좋아요!좋아요!,5
1149,구성도 좋고효과도 있었음 좋겠구만열구성도 좋고효과도 있었음 좋겠구만열구성도 좋고효과도 있었음 좋겠구만열구성도 좋고효과도 있었음 좋겠구만열구성도 좋고효과도 있었음 좋겠구만열,5
1150,닥터자르크만 사용하는데요이번에 다른 비비있어서 그거 쓰고 살려고 했는데다른건 한것 같지도않고 기름져서...다시 재구매발림도좋구요 너무뻣뻣하다싶으면 에센스 살짝섞어서 사용하면되고욤사은품에... 이번엔 가격도 저렴히사서 왕뿌듯합니다감사합니당,5
1151,사은품 잘챙겨주셔서 감사해요잘쓰겠습니다,5
1152,좋아요......................................................,5
1153,원래 듀드롭 썼었는데 샘플 써보고 실버라벨로 반해서 옮겨왔습니다 ㅎ피부 하얀편인데 잘 맞아용뭣보다도 하루도 안걸린 빠른배송과 후한 사은품이 매우몹시 좋습니다 ㅋ구매 추천! ㅎㅎ,5
1154,제가 닥터비비를 썼는데 사은품으로 온 비비를 엄마가 쓰시고 엄마도 닥터를 쓰네용!정말 좋습니다.사은품도 많이 챙겨주시고 배송도 빠르고 좋아욧 11,5
1155,친구가 권해주서 구매했습니다. 갑자기 트러블이 심해져서 비비크림을 먼저 구매했는데써보니 좋으네요..쌤플들도 써보니.. 만족해서 다른 상품도 주문했습니다^^,5
1156,  발림도 좋고 잘 쓸거 같네요...,5
1157,커버력이 진짜 좋은거 같아요 약간 두껍게 발리긴 하지만 좋아요 ,5
1158,발림성 좋고 적당한 커버력에~실버라벨만 사용한답니다~ 사은품도 나름 많구 좋아요,5
1159,사은품도 만족하고 배송도 익일배송이라 너무 좋아요. 많이 파세요.,5
1160,근데 다른분들에비하면 샘플이..좀 복잡하네요 필요없는것만ㅠㅠㅠㅠ어쨋든 비비는 잘산듯,5
1161,샘플로 써보다가 좋아서 구입했어요커버력도 좋고 만족해요!사은품도 푸짐하게 왔네요 잘쓸게요~,5
1162,친구가 추천해서 샀는데커버력도 괜찮고 좋습니다.ㅎㅎ사은품도 대박 많이 보내주셨어요ㅎㅎ,5
1163,완전 대박~~ 가격으로 구입했네요~동생이 매번 사용하던거라.. 구입해줬는데 요거요거 유명한 비비이다보니.. 배송도 빠른편이구요..사은품도 빠방하게 와서 좋네요 ㅎ,5
1164,상품평만 보고 구매했어요 가격도 싸고 괜찬을것 같아요,5
1165,좋다구 해서 썼는데 아직까진 괜찮아요...트러블이 많은편인데 괜찮아요,5
1166,피부에 밀착감도 좋고 바른뒤 화사해지는느낌이에요,5
1167,"배송도 빨리왔구, 사은품도 가득담겨왔네요^^비비크림 하나 주문했을뿐인데.......^^역시 이벤트 기간에 주문해야하는듯해요ㅎㅎㅎ입소문 난 제품이라 한번 쓰고싶어서 주문했어요.^^잘 쓸게용^.^",5
1168,좋네요커버력돚 좋고 발림도 좋고아주 만족합니다.구성품도 잘 챙겨주셔서 감사해요 ㅎㅎ,5
1169,원래 자주 사용하는 브랜드라..비비크림도 여러개 사서 쓰고있네요..저는 괜찮은거 같아요,5
1170,매트한 것이 번들거림없이 잘 펴져요. 굿입니당~,5
1171,샘풀 써보고 주문했는데 잘 한것 같아요사은품도 맘에 들고..제품도 맘에 들어요...,5
1172,"닥터자르트 실버라벨 BB크림!!건성피부인 편인데, 뜨는 느낌없이 촉촉하고 매끄럽게 착 감겨서너무 좋아요.항상 실버라벨 BB만 쓰고있답니다.샘플도 많이 챙겨주셔서 너무 좋았구요.가격도 저렴한편인데~ 닥터자르트 제품들은 바른 후 느낌과 피부변화가 금방금방느껴지는 것 같아요.",5
1173,저렴한 가격에 마음에 쑥 들어요. 배송도 정말 빠릅니다.,5
1174,주변에서 추천 받아서 구매했어요~다른 쇼핑몰보다 사은품이 많고 할인이 많이 되어 Hmall에서 구매했어요.빠른 배송 만족하구요~ 저한테 잘 맞았으면 좋겠습니다^^,5
1175,아직 써보진 않았는데 배송은 빠르네요 잘쓸께요 피부랑 잘 맞았으면 좋겠어요,5
1176,아직써보진않았지만 다들좋다고해서 저도 구입했어요기대만땅~ㅎㅎ써보고 다시 후기올릴께요근데 다들좋다고하니까 믿어도될듯~ ㅎㅎ,5
1177,다양하게 샘플도 사용해볼 수 있어서 좋았구요물론 본품인 실버라벨도 닥터자르트 제품 첨 쓰는데좋은인상으로 제가 또 살 수 있겠네요 ㅋㅋ 굳,5
1178,커버력짱이예요~~샘플도 많이 챙겨주시고 좋아요~,5
1179,커버력좋고 건조하지 않고 색도 밝은 톤 조아요조아요,5
1180,"괜찮은 것 같아요, 함께 달려온 샘플이 많어서 좋구요. 가볍게 외출할 떄 좋긴한데요.색상이 좀 어두운 것 같아요. 그래도 가격대비 만족스럽거든요. 다 쓰면 재구매할 의사도 있어요.",5
1181,매번 사용하던 제품이라 말할 필요가 없지만.. 사은품이 많이 와서 정말 놀랬어요~만족 해요~,5
1182,"깜짝 놀랐어요..용량이 생각보다 넘 작아서..샘플보다 약간 큰 크기??양은 적지만,,품질은 우수했으면 좋겠어요..",5
1183,"그동안 한.., 헤., 써보았는데 그중 제일 좋은 거 같아요..잡티도 많이 커버되고 지속력도 있고 일단, 피부가 윤이 나 보여서 좋네요비비를 쓰다가 한동안 계속 쓰면 피부가 좀 나빠지는 거 같아서 중단 했었는데이거 정말 많이 팔린 상품이라 가격도 부담없어서 혹시나 하고 사봤는데좋네요~~",5
1184,사은품도 많이 주고 좋네요.선물해서 제품이 어떤지 모르겠지만... 좋을 것 같아요.,5
1185,지금 막 주문했는데 원래 쓰던거라서ㅋㅋ사은품도 많고 가격대비 좋네요ㅋㅋㅋ기대됩니다ㅋㅋㅋ,5
1186,잡티가 있는데 자연스럽게 커버가 되고 가벼운 상용감이 괜찮습니다,5
1187,배송도 빠르고 다른분들이 받은만큼은아니지만사은품도 사진에 있는것만큼은 다 챙겨주신것같아요 전 이정도면 만족!가격혜택도 좋았구요.만족만족만족~,5
1188,제가 워낙 헤라 비비쓰고 있었는데...이 BB는 첨 느낌이 생각보다 매트하더라구요....그리고 색상은 좀 검은것 같은데 막상 바르면 약간 너무 하얗게발려지더라구요...근데 시간 지나니깐 그건 괜찮더라구요....(얼굴색이 약간 까무잡잡해서 그럴지도)한번 써봐서...더 써봐야 알 것 같네요...근데 아주 좋다는 생각은 솔직히 좀 안들어요.. 약간 파운데이션 느낌이에요,5
1189,늘쓰던거라 만족하고 또 구매했습니다. 쿠폰써서 정말 저렴하게 구입했어요,5
1190,"퍼짐감도 좋고, 사은품도 많고, 사은품 중에 비타민 c 에센스 아주 좋던데요. 닥터자르트 제품 처음 써보는데 아주 만족스럽습니다. 자주 애용해야겠어요.",5
1191,두번째 구입했는데요 늘 쓰던 거라 좋아하세요 ~,5
1192,BB샘플에..여러가지많이주셨네요...감사해요*^^*,5
1193,늘쓰던거라세일을이용해한개삿네여샘플ㄹ도마니오고너무좋습니다,5
1194,닥터자르트 커버력 진짜 좋음닥터자르트 커버력 진짜 좋음닥터자르트 커버력 진짜 좋음닥터자르트 커버력 진짜 좋음닥터자르트 커버력 진짜 좋음,5
1195,백화점용도 너무 매트해서 바르기 힘들어서 몇개를 실패했는데 반신반의하면서 구입했어요.결과는 대만족입니다. 잘바라지고 바른후에는 촉촉하게 지속됩니다. 강춥니다.,5
1196,우수고객코너에 들어가니 할인율이 더 크네요....어느분이 글남기셔서 혹시나해서 저도 들어가봤답니다.땡잡은 느낌입니다.본품도 좋겠지만...샘플이 빵빵합니다. 파우더랑 세럼이 제일 맘에 드네요...사보구 괜찮으면 또 구매할게요..,5
1197,진짜갠찮은제품진짜갠찮은제품진짜갠찮은제품,5
1198,이렇게 유명한건ㅈ ㅣ몰랏는데 쓰다보니 애들이 아 이거한번만써보자고 유명한거라고 하더군뇽트러블에 ㅈ ㅣ성피부인데 썬크림안쓰고 크리니크 쒀지크림 다음 바로쓰는데요그런것치고 트러블 안나네요! 암튼 조하용,5
1199,굳굳..ㅣ진짜조아요칭구가 써서 주문했는데 정말좋습니다,5
1200,빠른 배송 감사하구 우리 딸이 넘 좋아하네요~~~,5
1201,좋습니다.아아 근데 구입하고 나니 사은품이 더 많으네요-_-그래도 잘 받았습니다.닥터자르트 비비 샘플 써보고 좋아 구입하는겁니다.좋으네요-^^,5
1202,여기 브랜드는 첨 써보는데 상품평이 넘 좋아서 구매 하게됐습니다빨리 왔음 좋겠네요..,5
1203,배송도빠르고 좋네요 가격은 뭐 그냥 그래요 ,5
1204,이게조테요..발림성은 좀 뻑뻑한거 가테요 사은품많이 주션네요..,5
1205,"배송도 정말빠르구요, 사은품 정~~~말 많네요!!!쿠폰쓰고 적립금써서 반값에 구매해서 더욱더 뿌듯합니다.커버력정말 좋구요!!!완정강추강추강추",5
1206,역시 닥터자르트 저번에도 시켜본적이 있는데배송도 빠르고 사은품도 짱짱합니다 !,5
1207,빠른 배송도 감사하구요..기대이상의 많은 사은품도 감사드려요잘 쓸께요,5
1208,본품은 원래 쓰던거라 뭐 두 말할 필요 없이 좋구영...샘플키트에 풍성하게 들어있어서 정말 기분 좋네영 ^^샘플 잘 써보고 앞으로도 애용하겠습니다~,5
1209,우체국택배로 방금받았어요어제주문했는데 배송빠르네요우선 사은품땜시 급실망.. ㅠㅠ분명 어제주문할땐 샤이닝베이스랑 비타드롭 이론거였는데바꼈나봐요 미네랄파우더랑 요론거왔어요다른데서 사은품이 미네랄파우더길래 고거시로서 여기서 산건데...에궁... 그래도 다른데 보다 저렴하게 샀구 하니깐 나름..ㅋ포장은 박스에 잘되어서왔구요 제조일도 4월이네요 ㅋ정품라벨 붙어있구요~음.. 이비비는 제동생이 벌써 두통째 쓰고있어요커버력좋구 다크닝이 덜하다나 발림성도좋구 민감성피부도쓸수있는게장점이죠~근데 전건성이라 선듯못사고있었어요 촉촉한타입은아니라서근데 날이 더워지고 습해지니 피지도 슬슬올라오거 해서 겨울엔좀그랬지만 이젠 피부에 맞을것같아서 동생꺼 발라보거 신청해서 사봤어요 요건커버력이좋아서 조금만 발라두되니깐 용량은50미리지만 꽤 오래쓸것같아요배송도 빠르고 사은품도 많거 가격도 다른대보다 싸궁 현대가 짱이긴하네요~~,5
1210,상품평이 좋아서 구입했어요.받으시는분이 좋아했으면 좋겠어요.샘플도 많이 챙겨주시고 감사해요.,5
1211,ㅂ비크림으로 처음써보는건데기대가 크네요,5
1212,동생이 샘플 몇개 써보고좋다고 해서 샀어요샘플도 많이 주고 좋네여배송도 빠름ㅋㅋ,5
1213,닥터자르트 처음 구매해보는데요~~평들이 좋아서요~ 기대가 커요~~ㅋㅋ샘플도 많이 주셔서 감사하구요 ㅋㅋㅋ,5
1214,"샘플은 좀 적어서 실망이었지만 상품은 넘 좋네요.. 맘에 쏙 듭니다,,ㅎㅎ생각보다 사이즈는 좀 작지만 조금만씩만 써도 되네요,,피부가 좋아보여요~~",5
1215,잘 발리고 들뜨지 않고 좋은거 같아요샘플도 넉넉히 보내주셔 좋았구요~~,5
1216,"좀 어두운 감이 잇어서....제가 21호를 쓰긴 하지만 평범한 편인데....목과 많은 차이가 나서.....저만의 문제 일지도,.....",5
1217,발림성도 좋구 가격도 좋구 괜찮은것같아요.동생이 쓰고있는거보고 저도 한번 구입해봤는데 동생만큼지속력이 있진않지만 좋은것같습니다배송은 2~3일정도 걸린것같아요,5
1218,부드럽게 발리고 잡티도 커버해주고 괜찮습니다.,5
1219,동생 선물 해 줬는데샘플 넉넉히 챙겨주셔서 동생이 좋아라합디다~,5
1220,친구가 닥터자르트 비비크림을 안 써 봤다기에마침 생일이라 선물로 주려고 샀어요.마음에 들었으면 좋겠네요.,5
1221,"3개째 쓰고 있어요커버력이 좋아요,,,,,,,,",5
1222,주위에서 좋타고 써보라 해서 구매해 바로 써봣는데요.. 좋아욤,5
1223,몇 년째 쓰고 있는 제품입니다.이번에는 샘플도 무지 많이 왔네요~잘 쓸게요~^^,5
1224,"제품 자체는 괜찮은데요,.제 피부색하고는 좀 안맞네요..동생 줄까봐요ㅠㅠ",5
