,review,score
2872,실버라벨 아직 사용해보진 않았지만 좋을거가타요~배송도 토욜오후에 시켰는데 화욜에 오고 짱빨라요~좋아요ㅛㅛ,4
2873,기대 보다는 무난한 비비 같아요. 색상이 저한테는 좀 어두운것 같아요.요즘 바르고 다닙니다.,4
2874,주문하고 다음날오네요 실버라벨 비비 샀는데 기타 다른거 많이줘서 좋았어요~ 써보고 좋으면 써야겠어요~ ,4
2875,건성피부인데 커버력 좋은걸 찾다가 실버라벨을 샀습니다.커버력은 좋은데 처음에 좀 답답한 느낌이 있어요.지속력은 비교적 괜찮은 듯 하네요.,4
2876,저렴한 가격에 마니마니 잘샀구요 샘플로 준 ㅏㅇ품들이 더 좋았던거 같아요,4
2877,잘 받았어요샘플써보구 주문했는데 피부에 잘 맞는것 같아요,4
2878,애용하는 비비입니다딴것보다 밀착력도 좋구 커버력도 좋아요,4
2879,"잘 받았습니다. 전에도 사용했던거라 이상은 없네요,잘 쓰겠습니다.",4
2880,아직 사용전인데 예전에도 닥터자르트 비비를 써봤던 터라 좋을듯하네요,4
2881,비비는 항상 여기서 사요발리는 느낌이 좋아요제품에 믿음이 가요,4
2882,"늘 쓰던거라 또 주문했어요잡티가리는데 짱인듯,, ㅋ",4
2883,그렇게 좋은줄은 모르겠어요..그저그래요..,4
2884,계속 쓰는 비비크림이에요커버력이 있고 기름지지 않아서 좋아해요,4
2885,항상 사용하고 있는데 정말 너무 좋아서 대량 구매 했답니다.. ,4
2886,사용전이지만 상품평을 믿고 써보렵니다다른 곳에서 더 싸게 팔더라구요그것이 좀 아쉬운 점 이네요,4
2887,실버라벨이 좀 매트한 느낌이 있어요.그래도 커버는 짱~,4
2888,면세점에서 화장품 사기전에 좀 급하게 필요해서 저렴하게 구입한..다른 비비랑 뭐 별반 다르지 않다는 생각이 드네요~ ;;,4
2889,매트하지 않고 잘 발립니다~자연스러운 피부 연출에 좋은 제품인것 같습니다.아쉬운점은... 홍조가 커버가 안되네요~그래도 물광느낌 내고플땐 피부에 부담없이 바를 수 있어서 좋습니다.,4
2890,"친구가 좋대서 저도 사봤는데비비는 아직 사용전이고, 사은품 폼클렌져만 먼저 써봤어요폼클렌져가 무척 좋네요 거품도 풍성하고 아주 개운하게 잘 닦여요닥터자르트 제품 이번에 처음 사본건데관심이 많이 생겼어요",4
2891,괜찮네요괜찮네요괜찮네요괜찮네요괜찮네요,4
2892,사실 제가 병적으로 비교를 해보긴하지만 ㅋㅋ전에 쓰던거랑 글씨 비교해보니깐 좀 다르더라고요 ㅎㅎ매번 바뀌나봐요 ~~ 닥터자르트 는 뒤에 내용들이요!!무튼 ㅋㅋ 잘 쓸께요,4
2893,잘 쓰겠습니다.ㅎㅎㅎ좋아요^^샘플도 잘쓸께요,4
2894,유분기가 덜한 느낌은 있지만 커버력은 짱이네요.,4
2895,역시 소문만큼 괜찮은 제품인거 같아요!~잘쓸게요 ㅎㅎㅎㅎㅎㅎ,4
2896,완전 지성이라 구매해봅니다. 손등에 발라보니 매트하지만 잘 발립니다. 기름기가 적어서 일단 만족하구요.얇지만 커버력잇는거같아 만족합니다.,4
2897,샘플을 사용해보다가 좋아서 구입해봣어요 ^^너무 커버가 잘되서 좋아요 다음에도 구입해야겟어요,4
2898,역시 커버력 대박 짱이네요 !!!!!근데 약간 건조한거 같아요내 피부가 변한건가 ㅠㅠㅠㅠㅠㅠㅠㅠ암튼 짱 좋아요 ㅎㅎㅎ,4
2899,"구성품은 다른행사보다 약하지만,가격이 좋아 구입했어요.커버력이 좋아 잘 사용하고 있어요.선물포장이 안되는 건 좀 아쉬워요.",4
2900,누가 추천해서 써보는 건데 커버력 좋으네요좀 뻑뻑한 감이 없진 않습니다만 다른 건 맘에 듭니다잘 쓸게요...,4
2901,사용전입니다.상품평은좋아선택했는데요좋을지모르겠네요.,4
2902,블랙이랑 실버중에 고민하다가 지성이라서 실버로햇는데.. 색상도잘맞고 좋네요~,4
2903,좋다는 얘기를 많이 들어서 구매했어요. 근데 사은품은 좀...,4
2904,재구매입니다. 무엇보다 커버력이 탁월하더군요. 색조화장은 BB크림 하나만 쓰니까 커버력에 중점을 두게 돼서 만족합니다. 그래도 겨울에 쓰기에는 너무 건조해서 다른 제품과 섞어서 썼습니다. 가격대비 만족합니다.,4
2905,저렴하게 사서 잘 쓰고 있어요........잘 쓰고 잇어요,4
2906,조아요조아요조아요조아요조아요~~~~~~~~~~~~~~~~~~~~~~~,4
2907,특별히 뭐랄까 인상적이진 않고 VIP 몰에서 싸게 팔길래 구입했습니다. 발림성은 괜찮지만 약간 유분은 겉도는 것 같고.... 뭐 그러네요.. 가격대비 만족...하는 정도예요...,4
2908,"색상을 선택할 수 없는 아쉬움이 있지만,괜찮은 것 같아요, 촉촉함도 있구요.커버력도 좋구요~",4
2909,닥터자르트 비비는 두번째 구매입니다.건성이라 처음에 블랙라벨을 샀었는데 딱히 좋다고 못하겠더라구요.그런데 같이 보내주신 샘플에 실버라벨이 있어서 사용해봤더니 저에겐 실버라벨이 딱 맞더라구요.같이 보내주신 사은품도 대박!!!!!다쓰고 재구매 또 할껍니다!!!,4
2910,커버력도 좋고 부분지성인 저에게 딱입니다. 역시 닥터자르트네요.,4
2911,처음 써보는데 좋은 것 같네요ㅎㅎㅎㅎ더 써봐야 하겠지만,4
2912,커버력도 좋고 ~ 잡티가 심한 편이라 컨실러랑 섞어씁니다,4
2913,역시 쓰던거라 저에게는 잘맞네요!잘받았습니다!샘플도 감사해요~,4
2914,나름 괜찮네요..다른 행사때는 파우더도 주고 샘플도 많던데..이번엔 좀..없는듯..,4
2915,구매한지 좀 지나서 상품평을 씁니다..사자마자 특가 + 사은품이 바뀌어서정말 정말 아쉬워서 ㅠㅠ상품평쓰기 싫었어여 ㅋㅋ그래도그래도 저렴하게 샀으니............................ㅜㅜ이럴때도 있고 저럴때도 있겠죠? ㅋㅋㅋ,4
2916,사은품은 생각했던 것보다는 별로라 아쉬워요저렴하게 사서그런지 핸드크림은 안왔더라고요본 제품은 테스트로 잠깐 써봤는데 괜찮은거같아요,4
2917,비싼것 써도 기능은 비슷한거 같아서 제일좋다는 닥터 실버 구입해보네요다사용후에 사용후기 올릴께요,4
2918,비비크림 찾다가 세일하길래 구매해봤는데 가격대비 괜찮은 것 같아요. 함께 온 샤이닝 베이스는 생각보다 커버력이 좋거나 광채가 나거나 그렇지는 않아요.... ,4
2919,21호 정도라는데 생각보다 색이 어둡고 베이스는 예상했던 것보다는 별로였어요,4
2920,발림도 좋고커버도 좋고전 너무너무 맘에 듭니다.,4
2921,,4
2922,리뉴얼 되기전 상품이 커버력은 더 있는거 같아요조금 부드러워지고 그랬는데...잡티는 조금 덜 가려지는 느낌이예요그래도 색상도 괜찮고 발림도 편해서 좋네요~,4
2923,샘플 써보고 맘에 들어서 구매했어요BB로 유명하다는 랑*제품 사용하고 있는데...전 맘에 안들더라구요그래서 다 사용하지도 않았는데 샘플로 써보고 만족한 BB샀어요이것도 좋고 코리**BB도 좋드라고요ㅋㅋㅋㅋㅋㅋㅋㅋㅋㅋ,4
2924,첨구매한거라 아직안써봐서 잘모르겠어요 상품평좋다고하니 믿고 샀어요,4
2925,항상 쓰는 비비크림이라 선물용과 내가사용할 두셋트주문했어요전에 블랙라벨을 사용했는데 아들이 사은품으로 받은 실버라벨을 줘사용하니 얼굴색에 어색하지않고 더 좋아 계속 실버라벨을 사용하고 있어요근데 사은품이 한셋트것만실망 ㅜ.ㅜ빨리보내주세요~~~오~~~사은품!!!!!,4
2926,동안 피부는 만들어 줘요~~방부제가 아들어 있는지 몇번 사용후 상해서 버렸어요ㅠㅠ아까워요,4
2927,딸아이 선물로 사주엇는뎅 가격도 착하고 파우더까지 주셔서 감사 ㅎㅎ 딸아이도 맘에들어하네요,4
2928,"비비크림 첨 써보는데 생각보다 괜찮은데용,,ㅎㅎ",4
2929,실버라벨 좋다는 소리를 많이 들었는데괜찮아요 다음에 또 사고 싶어요,4
2930,커버력도 좋고 미백 기능이 있어서 아주 좋아요^^,4
2931,펄이 있어 자연스러움 표현하깅ㄴ 그렇네요 좀 번들거디라 ,4
2932,사은품도 주시구... 비비크림 예전에 쓰던 거라 주저없이 구입했어요.,4
2933,실버라벨 bb크림을 구입했는데 전에 사용했던거란 많이 다르네요. 전에 것이 커버력은 더 좋았든것 같아요.,4
2934,항상쓰는화장품이라 바로구입했어요 좋습니다 구입하세요,4
2935,샘플도 많고 좋네요밤에 받아서 아직 못써봤지만 기대됩니다손등에 발라봤는데 얼굴이 아니라 잘 모르겠지만 꽤 맘에드네요,4
2936,조아요조아요조아요조아요조아요조아요조아요조아요조아요조아요,4
2937,BB 크림 사니까 미네랄 BB팩트 정품이 따라오네요!! 이것저것 더 추가 구매하니 사은품도 빵빵하고 좋네요!!!,4
2938,"역시 좋으네요, 크림은 샘플로 쓰다가 구입했는데, 커버력은 물론 오랜시간이 지나도 잘 유지되는것 같아요. 그리고, 팩트는 안써봤는데 기대가 되요^^ 좋아요~~",4
2939,저렴한 가격에..빠른배송까지..저렴한 가격에..빠른배송까지..,4
2940,리뉴얼 된건 첨 써보는데 어떨지 궁금하네요.........,4
2941,좀금 어두운것 같아요 커버력은 좋아요 ..저에게는 안맞는것 같아요,4
2942,이벤트기간이라고 해서ㅎㅎㅎ닥터자르트 실버라벨 비비랑 세라마이딘 크림 리퀴드 세개 주문했는데요그럼 4만원 이상 주문시 증정품이랑 7만원 이상 주문시 증정품이랑 다같이 오는건가요?머머오는지좀 상세히 써주세요 ㅠㅠㅠ,4
2943,일단 쌤플온거를 먼저 써봤는데 커버력은 좋은데 좀 촉촉한 느낌은 없고 매트하네요..수분크림이나 오일같은걸 썩어발라야겠어요 나쁘진 않은데 다음엔 블루라벨이나 핑크라벨로 촉촉한걸로 써볼 생각입니다 ~,4
2944,사은품으로 비비 2종 준다고 적혀있는데 그리고 다른 상품평은 사은품 많이도 주시는데왜 저만 아무것도 안주시는거죠? ㅠㅠ,4
2945,커버력도 좋고 가격도 저렴하고굿~~입니다!!,4
2946,정말 좋아요~가볍고 어느 정도 커버도 되고~~가격대비 완전 만족!!,4
2947,emeejsepfh rhoscksgejrnsdy.dkvdmfheh whgdms tkdvna qnxkermflqslek.,4
2948,,4
2949,"계속 사용하는 중이며, 가격대비 그냥 사용할 만 합니다..",4
2950,저렴하게 인터넷으로 구매하니 좋내여 좋아여,4
2951,운동후에 가볍게 바르고 싶어서 샀는데..너무 어둡네요~아직 많이 사용하지는 않았습니다.,4
2952,"전에 30ml짜리 사서 썼는데 다 쓰기도전에 오일층과 분리가 돼서찝찝해서 못쓰겠더라구요,, 오래된것두 아니구 뙤약볕에 노출된것도 아닌데...ㅠㅠ그래서 리뉴얼된 같은 제품 재구매했습니다용량이 많아서 언제 다 쓸진 모르겠지만 전 환하게 표현돼서 좋아요,,피부톤이 어두운 편인데 이것만 바르면 생기있어 보이구 얼굴좋아졌단 소리듣구 그렇거든요,,가을겨울엔 기초 잘 바르지 않으면 좀 건조할수는 있는거 같아요저두 요샌 크림 하나 더 바르고 다닙니다",4
2953,항상 쓰던 제품인데 리뉴얼을 한 거 같아요.좋아요.,4
2954,,4
2955,닥터자르트재품은 모두 맘에 듭니다. 비비도...,4
2956,리뉴얼 되고나서 안좋아졌다는 이야기가 많았는데 그래도 이만한게 없는 것 같아 건조해지기 시작하는 가을에 쓰려고 재구매하였습니다사은품 행사할때 구입하여서 사은품도 많이 오고 좋네요,4
2957,"6월달에 샀는데 이제서야 쓰네요,,,저는 지성인데,,, 지성한테 좋다고 해서 사서 기름종이에 테스트결과 유분기가 많더라구요 ㅡㅡ비비색깔도 좀 ;;; ",4
2958,샘플써보고 좋아서 샀는데 샘플이 더좋았던것 같습니다 기분탓인가,4
2959,커버력이좋은비비네요 첨가하신 상품 [2900원적립금 ★전구매 여행용 7종 체험분/5만원 이상 대용량 트래블 KIT 2종 증정★][닥터자르트] 실버라벨 리쥬비네이팅 뷰티밤 50ml (BB크림)   ,4
2960,좋아요 질도 좋고 너무 만족합니다 정말 좋아요 좋아요,4
2961,저번에 블랙라벨 썼는데실버라벨도 함 서봐야겠네요..사은품 많아서좋구요..가격도 저렴해요,4
2962,"커버력도 괜찮고,, 한스킨비비 쓰다가 요걸로 바꿔봤는데..쭈욱... ",4
2963,예전꺼보단 커버력이 떨어지네요 ~ 하지만 다크닝현상은 없어요 ㅋㅋㅋ,4
2964,어제주문하고 오늘받았어요. 배송빠르고 상품들도 최근상품들이라 만족합니다. 처음사봤는데 좋다는 상품평들이 많아서 잘쓸수있을것같네요. 지성인데 피부타입도 나눠져있고 맘에들어요.,4
2965,재구매한거임 좋음재구매한거임 좋음재구매한거임 좋음재구매한거임 좋음재구매한거임 좋음재구매한거임 좋음재구매한거임 좋음재구매한거임 좋음,4
2966,매일 파운데이션으로 메이크업하기 부담되서 구매했는데아직 써보진 않았어요,4
2967,처음엔 화사한듯 하나 시간이 지나면서 어두워집니다. 모든 비비가 다 그렇듯이...핑크라벨은 좀 다를라나...,4
2968,매트하니 괜찮아요.커버력도 좋고요.사은품도 많아서 좋네요,4
2969,테두리 블랙으로 착각? 깔끔해서 샀는데...카키색? 깜짝 놀랐어요;;;그냥 ...그래요,4
2970,생각했던 것 보다 훨씬 좋네요 ~많이 파세요 ,4
2971,맘에 들어요 조금 색이 찐한거 같기도 하지만그냥저냥 바르기좋네요,4
2972,뭐 특별나게 다르지낳은것같고 그냥 쓸만함,4
2973,사용하던 상품인데 너무 좋은 것 같아요맘에 들어요,4
2974,정품 외에 서비스 상품도 들어 있더군요. 배송이 빨라서 바로 잘 사용하고 있습니다. ,4
2975,여름에 쓰기 좋을둣해요커버력도 괜찮고 잘쓸게요,4
2976,남자가 쓰기에는 색이 밝긴 하지만 좋아요~^^ 추천 ,4
2977,상품평이하도 좋아서 기대감이 높았나봐요.발림성도별로고 좀 밀린다는 느낌이있네요,4
2978,리뉴된걸로 샀는데. 뭐가 달라졌는지는 모르겠어요.매트하긴 하지만 닥터자르트는 약간 회색빛을 띠고 있기때문에약간 다운된 느낌이 드는건 어쩔수 없네ㅛㅇ.그래도 기름기는 훨씬 준거 같아서 여름에 잘 사용하려구요.,4
2979,여름이 다가와서 기름끼 때문에 은근히 걱정했는데요..기름기도 많이 돌지 않고 얼굴도 편하고 좋습니다.제 피부색은까무잡잡한 편이예요~,4
2980,복합성인 제 피부에 잘 맞는거 같아요저렴하게 잘산것 같아요 만족합니다,4
2981,잘 받았습니다.리뉴얼 된걸 받았는데 용량은 똑같은데 왠지 양이 작아진것 같은건제 생각인가요...몇년째 쓰고 있는 제품이라 믿고 구매합니다.,4
2982,괜찮아요이게 리뉴얼 버젼인가봐요? 검색해보는데 이것저것 귀찮아서 그냥 샀네요..ㅋㅋㅋ근데 괜찮아요. 지성인데 기름나오는 것도 많이 줄었으요,4
2983,"몇 개 째 썼는데 예전 실버 디자인이 익숙해서 그런지, 왠지 구매가 망설여지더군요, 더 좋아졌다고 하니 일단 잘 써보겠습니다.",4
2984,약간 두껍게 발리는 듯한 느낌이 드네요 . 약간 두껍게 발리는 듯한 느낌이 드네요 . ,4
2985,쓸만해요쓸만해요쓸만해요쓸만해요쓸만해요쓸만해요쓸만해요쓸만해요쓸만해요쓸만해요,4
2986,"상품평을 보고 구입합니다.제겐 어두운 감이 없잖아 있지만잡티 커버도 되고, 비비크림 치곤 지속력도 있는 듯 합니다.",4
2987,"잘발리고 매트한게 기름진 피부타음 지성 피부나 지,복합성에 매우매우 좋을꺼 같아요다크닝도 별로 없구좋습니다!",4
2988,아직 사용전이랑. 어ㅣ ㅓㅁ링 ㅓㄴ래어 ㄹ맹널일,4
2989,"원래 사용하던거라 다 써가던차에 리뉴얼되어 새로 나왔길래 구성도 좋구해서 바로 질렀네요,,, 그런데 진동기기 주는 이벤트를 하고 있다니 좀 아쉽군요ㅜㅜ",4
2990,원래 실버라벨 사용했었는데 잠깐 다른 제품으로 갈아 탔다가 리뉴얼 됐다고 하길래 구입해봤어요.자연스럽게 커버되고 좋네요.근데 좀 물러진? 듯한 느낌이 드네요.,4
2991,마음에 듭니다.사고싶었던게..사니깐..기분이 너무 좋아요,4
2992,제가 처음 입문한 bb크림이 이 닥터자르트 bb크림인데요~완전 만족합니다~ 일단 피부트러블이 없어서 좋구요 가볍게 화장할 때 정말유용하게 쓰고 있습니다~ 강추!,4
2993,닥터자르트 제품의 샘플로 받아봤는데커버력도 좋고 발림성도 좋아 제품을 구매하게 되었습니다.현재 파운데이션이랑 섞어서 쓰고 있는데 괜찮은 제품이라 다음에도 구매하게 될 것 같네요.,4
2994,좋구요. 커버력도 괜찮고 기능이 괜찮은 것 같아요.,4
2995,늘 쓰던 상품이라 믿고 구매했습니다~좋네요 ㅎㅎㅎ,4
2996,하도 좋다는 평이 많아서 구입했는데 생각보다 별로네요..갠적으로 차앤박포뮬라 비비가 훨 좋은거 같네요..비교하다가 좀 저렴해서 써봤는데 아직까지 좋은지는 잘 모르겠네요,4
2997,"좋습니다 부드럽게 발리고.,. 사은품으로온 샘플들도 너무 좋아서 다음에는 본품주물할까 합니다부드럽게 발리고 흡수력도 좋고,, 피부도 뽀예보이고 좋다하는 bb다 써봤지만 이번에것이 제일 좋네요..ㅎㅎ",4
2998,조금 매트한느낌이 있긴하지만커버력도 좋고 이번에 두번째 구매예여~너무 매트해서 저는 썬크림이나 잘안쓰는 베이스 섞어서 쓰는데촉촉하고 좋더라구요~,4
2999,이거 사용하고부터는 피부 좋아졌다는 말 많이 들은 것 같아요 ^^물론 다른 것들도 사용하고 있지만... 커버력 좋은 것 같다는..,4
3000,이삼십대들이 쓰기에 좋은것 같아요색깔은 많이 밝게 나오는 편이에요할인도 많이 되고 사은품도 푸짐해서 좋아요,4
3001,최다판매라 한번 구매해봤네요..다른비비에 비해 커버력도 좋고 발림도 괜찮고맘에 들어요..한가지 아쉬운점은 pA++라는 점이네요..+가 세개는 있어야한다고뉴스에서 본적이 있어서요..,4
3002,신청해봤는데 아직 사용전이지만 상품평 믿고 써보려구요~상품평이 정말 많네요^^,4
3003,항상 이것만 쓰는데 잡티 정말 잘가려지는것 같아요!,4
3004,조금 발림성이 매트하지만 커버도 괜찮고 만족합니다.한스*쓰다가 바꾼건데커버력은 더 있는거 같아요^^,4
3005,"붉은 기는 가려주지만,음. 너무 답답한 느낌이 없잖아 있어요!그치만 뭐 나름대로 사용 굳.그리고. 뚜껑부분이 너무 넓어서.진짜 그 부분은 다른 디자인으로 바꾸는게 나을 듯.",4
3006,사은품이상품평에 올라온사진하고 다르네요..달랑 증정용 비타레이저 5ml랑 견본품 샘플 3개만 왔네요.다른분들이랑 차이가 많이 나서 좀 서운하지만 제품이 좋다고 하니 그냥 써보려고합니다. 잘 맞았음 좋겠네요. ,4
3007,처음 써보는 거라 아직은.................................................,4
3008,"분명 구성품 보고 구매 했는데. 미네랄 인 파우더,클린링바, 비비 샘플 마스크 등... 하나도 안오고. V7이 왔네요. 특히 파우더는 써보고 구메 할려고 구성품 확인해 가며 주문 햇는데 .. 보내 주셨으면 좋겠습니다",4
3009,트러블 피부라 아무거나 사용하기는 좀그랬는데 다들 좋다기고 믿고 구입했습니다....,4
3010,배송은 3일 만에 왔구요딱 샘플도 위에 표기 되어 있는 것 만 왔네요아직 사용해 보지 않은 상태여서 후기는.....,4
3011,제가 쓰다가 엄마도 하나 사드렸는데 좋다고 하셔서요~엄마 선물할려고 또 재구매하고 갑니다.,4
3012,사은품도 많고.. 밝은 피부톤을 만들어줘서 좋아요^^,4
3013,약간 조금은묽은감이 있네요 발림색상도 노랗지도 않고 피부와 잘 어울리는것 같아요여름이 아니라 유분감은 모르겠지만 밤에 피부상태 보면 유분감이 많을것 같지는 않구요용기가 좀 불편해요 나오는 입구가 크게 원에 파여 있어서 소량만 사용하는 저는 조금만눌러도 많은양이 나와 조심해야지 안그럼 그 소량에서도 반은 버리고 사용하네요,4
3014,박스가 다 뜯어져있고 사은품도 준다는 갯수가 아니고좀찝찝하긴 한데 워낙 상품이 좋으니 뭐 감안할수 밖에요,4
3015,피부가 흰 분들에게는 다소 어두울 수 있어요. 제품은 좋은데 색 선택 폭이 넓었으면 좋겠습니다.,4
3016,배송 진짜 짱이다.너무 너무 빨라요^^ 가격도 착하지만오늘 아침에 사용했는데특별한 느낌은 없어요~~,4
3017,실버비비 좋다고 소문나서 한번 사봤어요.. 10종샘플까지 푸짐하게 받았네요~근데 박스에 샘플들이 굴러다니네요-_- 어디 비닐에 좀 담아서 보내주시지;여튼 잘쓸께요~,4
3018,"발림성과 지속력 괜찮았구요,, 파운데이션과 섞어서 바르면 색상도 화사하고 좋습니다. ",4
3019,ahc비비쓰다가 조금 저렴한걸로 바꿔 봤는데 괜찮네요. 배송은 좀 늦은 편이였구요. ,4
3020,블랙라벨이 더 상품평조아서 그거사려다가샘플쓰고 실버라벨삿는대 조아요~~~~우선 트러블이 더 나진않구요친구가 피부조아보인다는소리까지 햇어요!!!만족해요!,4
3021,"금방 왔습니다.상자도 튼튼하고, 모든게 다 좋으네요.처음 써 보는건데, 좋은 거 같습니다.",4
3022,가격이 저렴하다지만 그래도 서비스는 정말 꽝이네요박스는 완전 다 찌그러지고 써보고싶은 샘플이있어서두개 신청했는데 샘플하나없고 실망이예요사자마자 받기도전에 바로 1+1 행사하던데 하루만 늦게살껄 후회했습니다,4
3023,좋은것 같아서 재구매 했습니다. ㄹㅇㄹㅇㄹ ㅇㄹㅇㄹ,4
3024,생각지도 못했는데... 사은품이 많아요!!제품은 한번 써봤는데 괜찮았어요!!트러블도없고 괜찮은거 같아요.,4
3025,맘에들어여 맘에들어여 맘에들어여 맘에들어여 맘에드러여 ,4
3026,약간 두꺼운 감이 없지 않아 있습니다. 대신 커버력이 좀 더 있는거 같아여.. 잘 사용중입니다.,4
3027,샘플도 많고 좋아요~좋아요~좋아요~좋아요~좋아요~좋아요~,4
3028,커버력 정말 좋은것 같아서 재구매했는데 역시 만족합니다 ㅎ_ㅎ,4
3029,닥터자르트 실버라벨 리쥬비네이팅 BB크림 기존에 사용했던 제품이라 믿고 재구입했어요~,4
3030,다른 제품쓰다가 생각나서 다시 주문합니다.괜찮았던거 같아서...번들거리지 않아요,4
3031,닥터자르트 실버라벨 리쥬비네이팅 BB크림 좋아요~,4
3032,제 피부엔 블랙라벨BB를 샀었어야했는데잘못골랐습니다 ㅠㅠㅠㅠㅠㅠ실버라벨은지복합성 피부용입니다! 매트돋아요 ㅠㅠ너무 매트해서전에 쓰던 비비에선 발견할 수 없었던주름 하나하나까지 숨김없이 다 드러내주네요 ㅠㅠ게다가 이건... 뭐랄까... 30대 초반분들이 조아하는정말 화장한 것같은 그런 모습이 됩니다...초기 분장 단계랄까...건성피부들은 한번 더 생각해주세요! ㅠㅠ피부 표현은너무 하얗게 됩니다.제가 이번 방학때 살을 좀 태우긴했지만나름 하얀편인데도얼굴과 목의 선명한 색깔차로 가부키가 따로없습니당 ㅠㅠ그래두 양을 좀 적게 쓰니깐그나마 낫긴한데... 블랙라벨을 샀었어야 했어요 ... ㅠㅠ,4
3033,쓰기 무난함미다 커버력도 괜찮고 번들 거리지도 않구요,4
3034,빠른 배송으로 잘 받았어요..상품평이 너무 많아서 구매했어요...좋은 제품이었으면 좋겠네요...,4
3035,닥터자레스를 쓰다가 다른 비비를 썼는데 좀 저한테 안맞는 것 같아서 다시 주문했어요.소문대로 비비는 닥터자레스가 좋은 것 같네요.저렴하게 구입해서 좋습니다.,4
3036,조금 어두운감이 있는데저는 리퀴드파운데이션이라 섞어서 사용하니 괜찮아요,4
3037,"피부에 바르면,, 싹 ~~ 바로 쓰며드는게 좋네요..그런게 커버력은.. 별루...여름철에 쓰기엔 좋은듯해요......",4
3038,샘플대신 쪼리가 왔어요 차라리 샘플이 더 실용성있구 좋은데 아쉽네여 ,4
3039,얼굴이 산뜻해보이고 좋아요. 오래 지속되네요~,4
3040,닥터 자르트 비비크림은 계속 써와서 제품의 질은 잘 알고 있어요. 잘 스며들고 색감도 적당하고 자외선 차단 지수도 알맞아서계속 잘 쓸거 같아요. ,4
