,review,score
2042,계속 이거쓰네요~트러블도 안나고 bb역할도 잘하고좋습니다^^,5
2043,생각보다 작아요. 양이 많을줄 알았는데 작아요.,5
2044,친구가 이거 쓰는데커버력이 좋더라구요 ㅋㅋㅋ그래서 구입햇는데역시 좋아요~~,5
2045,전에 쓰던건데 제가 화장을 잘 안하는편이라 2007년에 산 걸아직도 쓰고 있었네요 유통기한이 24개월인지도 모르고 ㅎㅎ근데 어느날부터 물이 나오기 시작하는거예요 흑흑..배송도 빠르고 구성샘플도 빠짐없이 왔네요워터드롭이랑 비비샘플이 똑같이 생겨서 워터드롭만 6개 있는 줄 알았어요 ㅎㅎ비비샘플 발라봤는데 전꺼보다 매트하게 발라지네요..제조일자는 2010년 4월7일이예요 ,5
2046,음~~ 솔직히 그다지 좋은건 모르겠구요얼굴이 그리 화사하진 않아요조금 바른듯 싶으면 뜨는것 같고커버력은 좀 있는듯그다지 부드렇게 발리지는 않지만 촉촉한지는 글쎄저렴해서 사긴샀는데제가 BB를 첨 사봐서 다른걸 써보지 않아서 좋은지는 모르겠어요그래도 저렴히 샀으니 잘쓸께요사은품은 진짜 마니 즈시네용,5
2047,비비크림은 워낙 몇번째 쓰는거라 두말할거없구요참고적으로 유분감은 많이 적어요.. 같이 보내주신 워터드롭은 함 써보고싶었는데...산뜻하니 괜찮네요.. 좋은 구성 감사합니다. ,5
2048,닥터자르트 실버라벨 리쥬비네이팅 BB크림 제가 쓰던걸 언니가 바르고 좋아해서 선물해줬어여~좋아했음 좋겠네여~~매트한걸 좋아하는데...매트하구 괘안은거 같아여~,5
2049,"원래 쓰던거 2번째 구입이에요~커버력도 좋고, 발림성도 좋고유분기도 적고 너무 좋아요^^",5
2050,샘플도많이주시고배송도빠르고마음에들어요비비가잘맞았으면좋겠네요/,5
2051,"선물용으로 산건데 예쁜 포장박스가 함께왔네요^^상품의 제조일자가 2010년 3월이라 안심했구요,비비크림 작은 튜브형이랑 수분크림 샘플이 같이 왔어요.기획상품이라 샘플은 기대 안했는데 챙겨주셔서 기분좋네요",5
2052,배송 완전 총알이네요~~~^^매번 블랙만 쓰다 실버는 첨이네요. 아직 안발라봐서 잘모르겠어욯ㅎ증정품이 좀 바뀌었네요 갯수는 맞는데 한 종류가 안왔네요,5
2053,다른 쇼핑몰 보다 가격도 저렴하고 일단 커버력조아요,5
2054,방금 받아서 써보진 않았지만 기대가 되네요.ㅎ친구의 추천으로 구매했는데 실망하지 않길 바래야죠.,5
2055,브랜드명이 낯설어서 망설이다 구매했는데 소문대로 좋습니다.제가 건성이라 색조화장하면 잘 뜨는 편인데 뜨지 않고발림성도 좋고 유수분 밸런스도 잘 균형을 이룬 것같아요.번들거리지 않고끈적거림없이촉촉하고 한번 바르면 수정없이 오래갑니다.,5
2056,샘플도 많이 주시고 좋긴한데... 원하던 샘플이 안와서..ㅠㅠ베이스 샘플만 왔네염......,5
2057,"전에 쓰던 제품이라 망설임없이 주문했어요.근데, 키트들이 위에 설명처럼 오지는 않았습니다. ㅠㅠ",5
2058,조아요...근데 난 건성이라..오후되면 당기고 건조함...,5
2059,"완전 넉넉한 샘플도 감동!저렴하게 잘 샀어요, 잘쓸게요^^",5
2060,커버력 정말 좋은 둣 해요.. 화장을 하지 않는 저로서는 넘 놀랐어요.. 정말 소량 발랐는데 얼굴이 허연것이~립스틱 안바르면 완전 환자같아요..ㅎ 커버력이 좋아 색조화장 하시는 분들은 좋아하실 것 같아요.. 저는 처음 바를때 그리 매트하지는 않았던듯해요..그렇다고 촉촉한 편도 아니고요~ 희안한게 커버력을 보면 두껍고 뜰 것 같지만 피부에 착 밀착되는게 약간 건조한 피부인데도 꽤 괜찮아요.. 지속력도 좋고요.. 암튼 꾸준히 써보렵니다.,5
2061,추천받아서 쓰게되었습니다.약간 메트한데 쪼끔씩 펴바르면 커버력도 있고 괜찮습니다 . ,5
2062,엄마가 이 선크림 써보시더니 너무 좋아하셔서 또 주문해드렸어요...이 썬크림 쓰면 화장이 잘먹어서 피부곱다는얘기를 많이 들으신데요...ㅋㅋ건성이신분들에게 아주 좋을듯합니다....그리고 샤이닝 효과가 있어서 피부가 윤기나보여요...실버비비도 엄마가 쓰신다길래...ㅋㅋ실버비비 좀 매트하지만 이 썬크림이랑 같이 쓰면 괜찮을거에요...저는 블랙비비가 더 좋아요...촉촉하고 색상도 맘에 들어요....비비는 닥터자르트가 가격대비 짱인거같아요...딴건 별루 ㅡ.ㅡ이구성셋트 넘 좋아요...두개를 저렴한가격에 살 수 있으니깐요...유통기한걱정했는데 최근이에요...닥터자르트 배송 짱빨라요...여기꺼 수분크림도 넘 좋아요...앞으로 자주 애용할듯하네용 ㅋㅋㅋ,5
2063,지성 피부라 항상 사용하던 제품인데요당연 피지조절은 타사 제품보다 낫구요이전 제품보다 자외선 차단 지수가 높아졌는데도번들거리지 않아 좋네요^^,5
2064,상품받고 3번째 쓴 오늘입니다.일단 소량을 쓰는대에도 얼굴에 고루 바를수있고~밀착력또한 좋은것 같네요..허나..살짝 두꺼워 보이기도하고..이것하나만 정말 소량 바르고 출근했는대 사람들이 풀메이크업한줄압니다.이게 장점인지 단점인지;;아무튼 전 탁월히 좋은지 나쁜지 잘모르겠고~무난하게는 쓸수 있을것같습니다.,5
2065,비비크림을 사려고 여기저기 기웃거리다가 우연히 닥터 자르트를 알게 됐거든요..어제 주문했는데 배송도 완젼 빠르고 오늘 낮에 받았습니다.저는 전형적인 중복합성 피부인데..요즘 봄이라 화장도 완젼 뜨고 난리도 아니었는데..오늘 요비비 크림 받고 딱 발라봤더니 제 피부가 그리 흰 편도 아닌데 딱 좋으네요..밀리거나 뜨지도 않아요.또 저는 사은품이 잘 못 온건지 워터드롭 대신 실버비비로 왔네요..정품 용량이 50인데 실버비비가 30으로 와서 오히려 더 좋은듯^^참 만든 날짜도 4월 7일 이더라구요.역시상품평이 좋은이유가 있는 듯 싶어요!!,5
2066,블랙라벨은 써봤는데 실버은 처음구입해보네요.샘플을 써보니 블랙보다는 커버력이 좋은것 같아요.다소 뻑뻑한 감은 살짝있는데 손가락으로 톡톡 두드려 주면잘 스며듭니다,5
2067,아주 좋네요^^*샘플로 보내준 비타민연고 같은 것도 너무 좋은거 같아서지금 주문하고있습니다^^*쌤플들 많이 챙겨 주시면 써 보고 재구매하게 될것 같아요^^*암튼 트러블 없이 피부에 잘 맞았으면 하나씩 닥터자르트로 바꿔볼라구요~~^^*,5
2068,품질도 좋고 아주아주 좋아요.... ekjdkdlskdlskslllll,5
2069,제품 잘 사용하겠습니다^^앞으로 자주 이용해야겠네요*^^*,5
2070,배송은 엄청 빨랐구요...기대를 많이 해서 그런가 저는 많이 건조하네요...,5
2071,"샘플사용도안해보고 평이좋아서 사본건데 민감피부에 별다른이상없고 무난하네여~가벼운화장에 피부좋아보이는정도 기능으로한거라,,,;;;;따라온 샘플도 미백이라바로 써보는중이고 가격대비^^",5
2072,만족하매 잘쓰고잇음! 재구매 의사도 있구요....ㅋㅋㅋ,5
2073,처음 써보는데 좋네요유수분도 적당한것 같고 특히 매트해서 좋아요^^,5
2074,"피부에 잘먹고 들뜨지 않아 좋습니다.늘상 애용하는데, 사은품도 많아 더 좋네요~",5
2075,구성도 좋고 저렴하고 좋아요...나중에 화장품 떨어지면 닥터자르트 다른 상품도 구매해 봐야겠어요..,5
2076,막내딸에게 선물 했더니너무나 맘에 든답니다^^,5
2077,배송도빨리왔고 아직 물건은안써봣네요워터드롭도 상품평 좋던데싸고 빠르고 좋은구매할수 있어서 기분좋아요~,5
2078,비비크림은 오랫동안 사용하던거라 또 구입합니다.커버력이나 발림성도 좋구요.. 이제품 사용하다가 다른제품은 별로라는 느낌이 들더라구요..썬크림과 같이 저렴하게 구입할수 있어서 좋아요... 포장도 선물포장으로 배송이 되었구요,5
2079,아직 써보진 않았고...작은 샘플들을 많이 보내줘서 기분이 좋네요...블랙 라벨 써보고 좋아 함 구매해봤어요,5
2080,사실 이건 제가 쓰려구 산 건 아니구 엄마 드리려구 산 거예요. 제가 이 BB쓰는데 너무 좋더라구요.이거 바른 날은 친구가 뭐 쓰냐구 물어볼 정도 ㅎ 그래서 엄마도 이번에 산다 그러셔서 제가 적극 추천 ㅋ정말 비비크림중엔 닥터자르트 실버라벨이 최고인 것 같아요!,5
2081,워낙에 상품평이 좋아서 일단 샀어여..ㅎㅎ 이제 써바야지여 ㅎㅎㅎ,5
2082,사용전이지만 좋을것 같아요.사용전이지만 좋을것 같아요.사용전이지만 좋을것 같아요.,5
2083,얇게퍼지는감이 좋네요~지성이라 번들거릴까 걱정했는데 번들거리지도않아요 ^^,5
2084,수분크림 독하지 않고 좋구요 구성이 좋아서 급 지른건데다 저한테 잘 맞아서 좋네요 ㅎㅎ,5
2085,"커버력이 너무 좋아서 친구꺼 써보고나서 바로 검색해서 찾아 주문했어요.역시나 한 번 발라보았던 상품이었음에도 불구하고 커버력 정말 좋구요..예민한 피부라 피부케어도 아무데서나 못받는 그런 피부의 소유자인데바르고나서 트러블같은거 없어요..제 친구도 친구동생이 저같은 민감하고 트러블이 잘 나는 피부인데이거 써보구 괘안다고 해서 자기도 추천받아서 쓰는거랬거든요..그래서 저도 피부과도 다니고, 피부고민 많이 하는 후배한테 요 제품 받으면서 함께 온 샘플주면서 적극 추천했답니다^^여러분들께도 강추예요..썬크림 위에, 요거바르고, 파우더만 살짝 톡톡 거려도 깨끗한 피부가 되는착한 화장품이예요..ㅋ 가격도 맘에 쏘~옥!!",5
2086,쿠폰써서 저렴하게 구입했구요..배송 빠르고 만족해요!!!,5
2087,굿! 다른 비비크림 쓰다가 이 상품이 좋아서 세번째 구입인데 번들거리지 않고 해서 좋아요 ㅋ,5
2088,아는 동생의 강력한 추천으로 사게 된 비비들뜨지 않을까 걱정했는데 웬걸..너무 좋다..가격도 착하고 성능은 더더욱 착하고.. ^^앞으로 나한테 완소 아이템이 될듯하다..,5
2089,세번째 쓰고있어요~갈수록 더 좋아지는것 같아요 ㅋㅋ만족만족 ^^,5
2090,커버력도 좀 있는거 같고 괸찮아요. 다만 제 피부가 좀 안좋아서 그런지 손으로 바르는데~ 발릴때 좀 뭉치는감이 없지 않아 있네요.,5
2091,닥터 자르트 좋다는 이야기 듣고 구입했어요~~현재 사용하고 있는 BB크림잇어서 쌤플만 먼저 사용해봤는데 괜찮네요~~,5
2092,"저렴한가격에 닥터자르트비비구매해서 좋아요~ 커버력은 아주 좋아요~ 그래서인지 약간은 화장이 두꺼워보이는경향이있긴하지만사은품까지 ~ ,이가격에 ! ",5
2093,깔끔하게 발리고유분기도 적당합니다중복합성 피부인 딸이 사용합니다,5
2094,상품평이다들 좋다고써있어서 궁금해서한번 주문해봤는데....빨리 왔으면 좋겠어요.,5
2095,동생이 써보고 좋다길래 구입했는데 저도 마음에 듭니다...,5
2096,좋다는 평을 듣고 구매했는데 생각보다 괜찮은 것 같네요.구성품도 좋고 대체적으로 만족합니다. ,5
2097,이번이 두번째 구입~~ 닥터자르트 좋아요.화장도 들뜨지도 않고 자연스럽게 표현되고요.펌프보단 손으로 톡톡톡 두드리는게 더 좋더라고요,5
2098,엄마 선물했는데. 좋다고 하네요.엄마 선물했는데. 좋다고 하네요.엄마 선물했는데. 좋다고 하네요.,5
2099,저렴하고 사은품까지 비비크림너무좋아요...,5
2100,ㅋㅋㅋㅋㅋㅋ 예전에 샘플 써보고 좋아서 결국 정품구매..ㅠㅠ역시 좋네요~! ,5
2101,저렴이 비비중에 진짜 좋은듯!!완전 만족입니다 ㅋㅋㅋㅋㅋㅋㅋㅋㅋㅋㅋ,5
2102,어제 주문하고 오늘 받았어요 배송빠르구요 3월말일 까지 행사가 끝나서 사은품 많이 못받아서 아쉬워요 용량은 50미리 생각보다 작아요,5
2103,"역시 좋으네요.발림성도 좋고 아주 좋아요.차앤박도 써보고 했는데, 뭐 비슷하긴 해도 좋아요.",5
2104,닥터자르트 유명하다해서주문해 봤는데 역시 괜찮네요..잡티 커버도 잘되고 색상도 화사하고...파우더 살짝 치고 볼터치 살짝하고 나니 무지 좋아 보여요..,5
2105,비비크림은 이것만 계속 쓰게되네요전 지복합성인데 제 피부에 잘 맞는것같아요 커버력도 적당하고hmall이 배송도 빠르고 이것저것 혜택두 좋구요^^,5
2106,최근꺼구 제품도좋아용커버력도 있는 편이구 색상도 밝아서 좋아요,5
2107,"친구가 준 샘플써보고 주문 했어요,,얇게 잘 발리고 잘 지워지지 않아서 좋아요,,잘쓸께요 감사합니다,",5
2108,"예전에 샘플을 통해서 실버라벨,블랙라벨 다 사용했었거든요,그런데 저한테는 실버라벨이 더 잘 맞아서 구매하였습니다.저렴하게 기획상품이라서 만족하구요!!배송도 빠르고 좋습니다",5
2109,너무 좋아요커버력도 좋고 발림성도 좋고 지속력도 좋네요배송도 빠르고 싸게사서 대만족,5
2110,아직 써보지는 않았지만 ;;배송은 빠르네요^^,5
2111,피부톤이 어중간한~ 노란 피부입니다.항상 21호 쓰는데~~..어두운 파운데이션도 많더라구요.근데 이 비비크림은 살짝 피부가 하얗게 보정이 되고..자연스럽고...대개 촉촉합니다.쓰면서도 만족하네요. ,5
2112,얇고 부드럽게 잘 발라지는데 색상이 좀 밝아서약간 떠보이네요,5
2113,배송정말빠르네용상품평들이 정말 좋아서 구입하게 됐어용복합성피분데빨간 자국이 많거든용저한테 잘 맞았으면 좋겠네용,5
2114,블랙라벨만 쓰다가 첨으로 실버 사봤네요...둘다 잘 발리는데 실버가 커버력이 좀더 좋아요..블랙은 주름까지 기능이 있던데 아직 뭐 주름은 ...커버력이 더 좋아서 실버가 더 마음에 드네요...,5
2115,어제 받아서 오늘 첨 써봤는대 가격대비 훌륭한 제품인거 같아요...이XX 피부과 비비쓰다가 바꿨는대 훨더 나아요....용량도 많구요...같이 준 사은품도 참 좋내요...거의 1만원대에 산거 같아요...다만 많이 번들거리지만 않았음 좋겠어요...닥터자르트를 함 믿어볼께요...,5
2116,"상품평 대로 좋습니다. 너무 많이 매트 하지 않아서 좋구요 자꾸 펴 발라야 뽀얗게 잘 스며 드는거 같아요 , 저렴한 가격에 잘 구입한거 같습니다.",5
2117,가격대비 짱이에요.. 커버력도 완전 좋아요..,5
2118,"1년째 구매해서 쓰는건데 좋아요! 자꾸 닥터자르트껏만 사게 된답니다,쇼핑몰에도 팔아서 너무 좋은거 같아요.매장보다 싸고.. 원래 쥐에쓰 이용했었는데 여기는 적립금까지함께 할인해주니깐 더 싸서 그게 더 좋은거 같구요 ^^앞으로 이용하려구요 ㅋㅋ ",5
2119,아직 사용전인데..상품평에 대한 기대감이 있네요..,5
2120,"모두 좋다좋다 그래서 너무 기대를 했었나봅니다.전 그냥 다른 비비크림하고 비슷한데요.발림성 좋고, 커버력도 어느정도 있는데 좀 어둡습니다.피부톤하고 잘 안맞아서 동생 줬네요.유분기가 살짝 있지만점심때쯤 파우더 한번 두드리면 괜찮아지고, 가격도 저렴하니 무난하게 사용할만 합니다.",5
2121,bb크림 좋다고 소문이 나서 저렴한가격에 좋은제품 만났는것 같아 기분이 좋네요....괜찮은것 같아요 밀리지 않고 매트한것이 ^^,5
2122,지금 2개째 사용하는데 커버도 잘되고사용감도 좋고 만족스러운 제품이죠~^^,5
2123,다른 비비크림을 사용하다가 바꾸어봤는데 가격도 저렴하고 좋습니다. ,5
2124,블랙라인은 써봤는데실버가 더 좋다고하니기대만땅~빨리왔음 조켓어요@,5
2125,제품이 좋아서 늘 쓰던 거에요.이번에 제품 포장이 바뀐 것 같네요.배송도 빨랐고 가격도 다른 곳보다 저렴하게 샀네요.,5
2126,소문 듣고 샀는데괜찮은것 같네요.할인쿠폰 있어서 싸게 구입했는데써보고 입소문 낼게요.,5
2127,이 제품만 4개째 쓰고 있습니다. 명품 수입브랜드 보다 훨 좋아요,5
2128,색이 회색이라 좀 부담스럽긴 하지만 바르고 한참후에도 유분기가 돌지않아 지성피부에겐 딱인듯 싶네요 ,5
2129,제가 구입해서 애인도 같이 구입했는데 너무 좋아해요 ^^,5
2130,상품평보고 샀는데 역시 좋네요....얼굴에 착착 달라붙는 느낌?? 색도 딱 적당하구요~~~다음에 또 구매할게요 ^^,5
2131,사용하던게 거의 바닥이라 어떤게 좋을까? 여기저기 구경하다 상품평에 혹해서 구입했어요.ㅋㅋ할인쿠폰과 깜짝할인 즐겨찾기등 저렴하게 구입하게 되어 기뻤구요.상품평이 절 배반하지는 않겠지요.암튼 잘 사용할께요,5
2132,"실버라벨 색상이 처음보다는 밝은색상이지만, 좋은데요^^",5
2133,좋아요 ㅎㅎ 근데;;; 왜 가끔 물이 나올까요;;;그건왜일까요;;;; 지성이라 조금더 묽게발렸으면좋겠는데 좀 갑갑한면이있어요근데 같이보내주신 수분크림....정말좋습니다 ㅎㅎㅎㅎ,5
2134,주위에서 닥터자르트 제품이 좋다고 해서여기서 비비 처음 구매해서 쓰는중인데요다른 제품은 고민 안해봐도 될거같아요자기피부처럼 표현되고 진짜 자연스러워요저한테는 딱인듯!!다음에 다 쓰면 또 구매할 생각이에요,5
2135,"블랙 라벨 쓰다가 실버 샘플 써 보고 구매했어여. 약간 밝은 편이고, 발림은 약간 매트한 듯 합니다. 잡티 커버 잘 되고, 위에 파우더 바르면 깨끗합니다. ^^",5
2136,엄마가 샘플 써보시곤 좋다고 하셔서 바로 샀어요~제조일자도 최근이고상품도 좋고 가격도 좋고 다 좋네요^^배송도 하루만에^^,5
2137,제가 유뷴기가 많아서 친구가 추천해줘서 써봤는데 좋은 것같아요~,5
2138,"닥터자르트는 워낙 유명하다 보니,,,벌써 5개째 쓰고 잇네요~~~피부 보정도 잘되고 발림성도 좋고 구매는 정말 후회하지 않으실꺼예욤!!무엇보다 샘플까지 넉넉히 챙겨주는 센스 ㅋㅋ항상 감사합니다!",5
2139,배송도 완젼 빠르고.....좋으네요.......잘 쓸께요..........,5
2140,피부가 약해서 피부과 BB크림만을 고집하던 저였죠..같은것만 몇통째 섰더니 조금 지겨워져서 바구고 싶던 찰나에 vip존이라는 곳이 있어서 들어가봤더니 값싸고 상품평도 좋은 BB크림이 있어서 구매했습니다.너무 좋아서 동생한테도 추천했더니 이미 사용중이더군요 ㅋㅋ서로 통했다며 좋아했죠~ 아침에 화장한 그대로 저녁까지 유지되구요기름이 생겨서 기름종이로 닦아도 화장이 번지지 않네요커버력도 띄어나고.. 정말 이만한 비비 없는것 같아요함께 배송온 워터드립이랑 선크림을 바르고 BB를 발라서 그런건지.. 암튼 너무 좋은 제품이예요~참! 배송도 완전 빨랐어요.. 오후에 주문했는데 다음날 아침에 받았거든요..가격두 싸고 ㅋ 잘 쓸게요 ㅋ ,5
2141,가격대비 좋은상품같아요할인도 받고 ^^배송도하루만에오고 `ㅋㅋ,5
2142,bb는 첨 사보는데 구매평보고 구매했어요..썜플도 주고 존네요,5
2143,"우선 지속력이 굉장이 길어요~~ 그거 정말맘에들구여~~그리고 저렴한 가격과 부드럽게 잘발리면서 커버력이 강해서 좋아요~~그런데 약간의 단점이라 할수있는 색상!!비비크림의 특유의 돌가루?!색상이 강한편이예요~많이 바르면 피부와 이질적인 느낌이 든다구 해야되나??암튼 그런느낌이 쫌 있어요~~ 그것말고는 꽤 괜찮은 제품이라 생각되네요 ㅋㅋㅋ그리고 제가 구매하였을땐 워터드롭과 썬메베 샘플증정 기간이라 두제품 모두 사용해봤는데괜찮은거 같아요`~ 두개 모두 살까 생각중이예요~~닥터자르트 가격싸고 좋다해서 속는샘치구 한번 사봤는데,,좋네요~~ 앞으로 자주 애용해야겠어요~~ㅋㅋㅋㅋ",5
2144,"배송도 빠르고일석이조의 효과도,,함께누리는 ^^",5
2145,상품평이 너무 좋아서 믿고 구매했어요..다른 상품평들처럼.. 작네요~^^;;,5
2146,"상품평 좋아서 구매했는데 좋네요~약간 두꺼워서 얇게 발라야 하네요~손으로도 얇게 잘 발리고, 커버도 잘되고,좋네요~ㅎㅎvip몰에서 더 저렴하게 사서 좋아요~",5
2147,배송도 빠르고 좋네요ㅋㅋㅋㅋㅋㅋㅋㅋㅋㅋㅋㅋㅋㅋ,5
2148,어제 주문했는데 오늘 오전10시에 수령했습니다.아직 사용전이지만 빠른 배송 기분 좋으네요~~,5
2149,"역쉬 좋아요~~커버력도 좋고,화사해보여 좋고,,, 피부도 좋아보이고,,닥터자르트 비비 역쉬 좋아요~",5
2150,월요일날 주문해서 화요날 받았구요..ㅋㅋ배송도 마음에 들고..오늘 처음 개시했어요.지금까지 베이컵메이스나 BB크림 쓰던거랑은 완전 차원이 틀리더라구요.완전 진짜 커버력 좋데요..한번 밖에 안썼는데..반해버렸어요..ㅋㅋㅋ앞으로 닥터자르트 BB크림 또 구매 할꺼 같네요.ㅋ그리고 샘플도 많이 주시고 감사합니다.ㅋㅋㅋ앞으로도 좋은 제품 부탁드립니다.ㅋㅋ,5
2151,사은품이 바뀌었네요 ㅎㅎ비비크림은 적어보이지만 한번 바를때 적은양만 쓰니까 괜찮은거같아요~,5
2152,역시 소문대로 좋네요!!만족합니다!!!!!!!!!!!!!!!!!!!!!!!!!!!!!!!!!!!!!!!!!!!!!!!!!!!!!!!!!!!!!,5
2153,주위사람들의 추천으로 주문해봐요 기대되요 ^^^^^^^^^^^ ,5
2154,어제 오전에 상품 결제후 오늘 오후에 받아보았습니다^^정말 빠른배송 만족합니다.샘플도 알뜰하게 다 챙겨주시고 너무너무 좋네요^^써보고 좋으면 다른친구한테 선물도 해줄려구요^^닥터자르트 에이치몰이 제일 저렴하고 샘플도 많고 최고예요^^ㅋㅋㅋ,5
2155,발림성도 좋고 괜찮아요.근데 샘플이 넘좋은데 양이 반밖에 안들어 있어 아쉽네요.,5
2156,000,5
2157,첨엔 너무 뻑뻑하고 내피부에비해(평소23호사용)밝아서 별루다 싶었는데요.....바른후 시간이 지날수록 환해지면서 커버도 잘되네요.싼가격에 잘산거 같아요.,5
2158,예전에 썼었는데 다시 주문해요조금 발라도 커버가 잘 되는 것 같아요,5
2159,닥터자르트 실버비비 좋아요^^커버력도 좋고 지성피부에 굿~,5
2160,입금한 다음날 상품 도착했습니다~배송 정말 빠르구요~사람들이 왜 닥터자르트 닥터자르트 하는지 알겠습니다~상품 정말 만족하구요~ 푸짐한 샘플도 감사 합니다망설이시고 계신분들 질러도 괜츈할듯 합니다 ㅋㅋㅋ,5
2161,상품평이 좋길래 구입했는데 기대 이상이네요... 커버력도 있고.. 맘에 듭니다. 배송도 빨랐고 가격도 저렴하네요~,5
2162,샘플로 먼저 써보고 구입한건데~발림성이랑 커버력 아주 좋아요~요즘 닥터자르트에 점점 빠져 드는것 같아요~글고~ 워터드롭~~ 요거요거 물건이에요~ 정말 얼굴에 물방울이 송글송글 맺히는기분~립 트리트먼트는 용량은 꾀 많고~ 향은 약간 강한감이 있기는한테 나쁜향이 아니라서 좋아요~ 게다가 자외선 차단두 되네요~,5
2163,닥터자르트 실버라벨 완전 맘에 들어요...커버를 중요하게 생각하고있는데... 커버기능 되구요...단.. 비비 바르기전에 전 베이크업 베이스는 꼭 바른답니다..오후에 거뭇거뭇하게 얼굴색이 변하지도않고.. 좋아요...친구 선물하려구 또 구입합니다!!참.. 사은품도 넘 좋아요^^,5
2164,잘스며들어서 화사하고 가격도저렴하고 좋아요,5
2165,생각보다 좋으네요~~피부색과 잘 맞아요번들거림도 적고~~,5
2166,역시 닥터자르트네요!!!다른 비싼 비비크림보다 훨씬 좋아요-밀리지도 않구요. 커버력도 좋아요. ,5
2167,하루전날 구매했능데 담날 바로 왔어욤^^완죤 죠아용~~워낙 유명하다고 하니깡 한번 싸보려고용~~감사합니당ㅎㅎ,5
2168,hmall에서 할인도 많이많이 받고~거기다 마침 행사중이라서 이것저것 샘플들도 많이 와서 기분이 좋은 쇼핑이었습니다^^,5
2169,^^커버력이 좋다고해서 믿고 구매했습니당~^^,5
2170,좋아요.할인된 가격으로 좋은물건 받아서 더 기분이 좋네요.,5
2171,어찌나 칭찬이 자자한지 하나 구입했어요실버로...근데 커버력이 너무 좋은데요지금까지 써본 BB하고는 비교가 안되요감사합니다.저렴한 가격...,5
