brandname,pid,pname,age,tags,repurchased,like_c,concern_list,skin_type,score,date,text
라끄베르,19758953,스노우 에센스 빅팩트,21,['촉촉한'],0,4,"모공,피부톤,트러블",복합성,4,2017-09-07,"크기 하나는 무지 크다. 그래서 갖고다니리란 마음은 빠르게 드랍하고 집에서 딱 한번 써봤다.
이 제품은 사진에서 보이다시피 핑크 베이스이며, 에센스가 들어있어서 그런지 촉촉하게 포현된다. 내가 매트한 것보다 촉촉한 걸 좋아했음 매일 바르고 다닐 것 같다. 3번째 사진은 위에서부터 평소에 치듯이 여러번 두드린 것, 약하게 한번 두드린 것, 안바른 것 순서이다. 색조는 아이라이너와 립스틱이다.
커버력은 사진에서 보이는 것 처럼 컨실러가 좀 필요할 것 같다. #촉촉한"
라끄베르,19758953,스노우 에센스 빅팩트,23,[],0,2,"잡티,트러블",건성,4,2017-09-10,"사용한 후기는 촉촉함, 자연스러움 이네요~
액체타입이아닌 고체타입이라서 고체파운데이션 느낌도
나고 커버력도 나름 중간 정도인 편인것같아요
피부톤이 21호보다도 밝은 편이라 저한테는 어둡게 느껴졌지만 자연스럽게 톤보정되고 용량도 완전 대용량이라
오래쓸수있을것같아요!!"
라끄베르,19758953,스노우 에센스 빅팩트,29,"['자연스러운', '촉촉한', '인생템', '추천템']",0,2,"건조함,피부톤,민감성",건성,5,2017-09-09,출근 정말 힘드시다면 이거 한번 만나보시길 저는 첨에 좀 불편하고 네손가락이 들어가니까 퍼프가 손에 안익어서 컨트롤이 안됬는데 진짜 팡팡팡팡 하면 끝..... 이건 쿠션사용법하고 좀달라요 하지만 너무 촉촉하고 바를때부터 수분감 왕창느껴짐 사진보면 아시겠지만 붉은기커버되요! 저는 커버높은것보다 자연스러움을 더 좋아합니다~ 딱 촉촉하고 피부가 수분먹음듯 이쁘게 표현되요 완전추천 #자연스러운 #촉촉한 #인생템 #추천템 
라끄베르,19758953,스노우 에센스 빅팩트,24,"['대왕팩트', '압도적인크기', '에센스팩트', '촉촉한']",0,1,"각질,건조함,피부톤",중성,4,2017-09-10,"체험단으로 받은 라끄베르 스노우에센스빅팩트입니다
빅사이즈라고해서 그냥 보통보다 조금 큰 사이즈인 줄 알았는데 정말 커요ㅋㅋㅋ 보통 팩트들은 조그만해서 손바닥 안에 푹 들어오잖아요..이건 제 손이 남자손마냥 크거든요? 근데 제 손바닥보다 조금 더 커요... 놀랬어요 너무 커서. 크기에 한 번 감탄하고 사용감 테스트를 해 보았는데요, 에센스팩트답게 광이 나요. 무지 촉촉하구요. 하지만 지성분들이 쓰기엔 불편하실거같아요ㅎㅎ 하지만 중건성인 저와 엄마는 굉장히 잘 썼어요
#대왕팩트 #압도적인크기 #에센스팩트 #촉촉한"
라끄베르,19758953,스노우 에센스 빅팩트,25,"['촉촉한', '추천템']",0,1,"잡티,트러블",복합성,4,2017-09-09,"일반 쿠션보다 훨 커요!
비교해보면 저정도에여!
당연히 퍼프도 엄청 커서 보통 퍼프는 손가락 3개 들어가면 딱인데, 얘는 네개 들어가여!
-
촉촉해요
커버력도 꽤 괜찮아요
짙은 점은 완벽하진 않지만 가려지구
-
얘는, 일반 쿠션처럼 톡톡 두드리면서 바르는게 아니라 처음엔 밀듯이 발라주고 다 바른 후에 톡톡 두드리면 되요!
-
피부 표현이 정말 예쁘게 되고 지속력은 촉촉한 베이스 제품치고 좋았는데, 길진 않았고 오랜시간이 지나면 화장이 날라가요
맨 마지막 두 사진이 지속력 테스트사진인데,
파우더처리하고 8시간 후 #촉촉한 #추천템 "
라끄베르,19758953,스노우 에센스 빅팩트,31,"['촉촉한', '커버력좋은', '자연스러운']",0,0,"각질,건조함,민감성",건성,5,2017-09-09,우와~ 완전 빅팩트!! 처음 받아보고 사이즈에 놀랐어요 열어보니 용량도 많구요 에센스가 들어있어서 그런지 촉촉하고 덕분에 피부도 좋아보여요 그리고 사이즈가 큰만큼 퍼프도 커서 바쁠때 몇번만 두드리면 끝이라 굳굳💕 #촉촉한 #커버력좋은 #자연스러운
라끄베르,19758953,스노우 에센스 빅팩트,35,"['자연스러운', '촉촉한', '추천템']",0,1,"주름,건조함,민감성",건성,4,2017-09-08,"#자연스러운 #촉촉한 #추천템 
쿠션의 위생이 걱정되어서 고체 팩트형 파운데이션을 여러개 써 봤는데 라끄베르는 다 중상은 가는듯해요 여러방면으로 무난한 파데가 조은파데라고 생각하는 사람으로서는 꽤 만족스러웠어요 쿠션처럼 두드려바르면 지워지거나 두꺼워지니까 사악사악 짧게 밀면서 얇게 바르는게 포인트라고 생각해요 견XX팩트처럼 촉촉하고 물광물광하지는 않고 중~중상 정도의 촉촉함과 중하정도의 커버력이 있어요 지속력은 파우더처리 했을시 6시간 괜찮았어요 오히려 귀가했을때 더 이뻤음! 케이스랑 향은  좀더 나아졌으면..하는 부분입니다"
라끄베르,19758953,스노우 에센스 빅팩트,23,"['촉촉한', '인생템', '추천템', '대왕팩트', '라끄베르', '팩트추천']",0,2,"모공,각질,민감성",복합성,5,2017-09-08,파우더룸 체험단 자격으로 사용하게 된 라끄베르 스노우 에센스 빅팩트! 제가 가지고있는 다른 쿠션들과 비교해보았을때 압도적으로 크다는걸 알 수 있어요!! 양도 2배!!! 거울도 크니까 메이크업 할 때 답답하지 않아요*^^* 그리구 건성인 제 피부에 발랐을때 몽글몽글 물방울이 생기면서 촉촉하게 발리더라구요! 엄마도 발라보시더니 정말 좋다고 하셨어요! 퍼프까지 커서 메이크업 시간이 훨씬 단축돼요!! 다 쓰면 구매해보려구요!! #촉촉한 #인생템 #추천템 #대왕팩트 #라끄베르 #팩트추천
라끄베르,19758953,스노우 에센스 빅팩트,32,"['촉촉한', '자연스러움', '추천템', '수분부족지성', '커버력좋은']",0,5,"모공,건조함,트러블",복합성,5,2017-09-08,"#촉촉한 #자연스러움 #추천템 #수분부족지성 #커버력좋은 
피부보정뿐만 아니라 자외선으로부터 강력하게 피부를 보호해준다는 점! 
팩트속 거울에 내 얼굴이 다 들어온다는 점!
파운데이션 표면을 손으로 살짝 돌릴때 손끝과의 마찰로 파운데이션 표면에 농축된 에센스와 같이 제형이 변하여 굉장히 촉촉한 파운데이션 제형을 만날 수 있었어요. 
수분부족 지성이라 군데군데 트러블과 염증으로 고생하고 있는 제 얼굴 붉은톤을 잡아주면서 원래의 이런 피부톤을 가지고 있었던것 처럼 촉촉하고 얇게 레이어링 해주더라구요. 
수부지의 답은 이것이에요!"
라끄베르,19758953,스노우 에센스 빅팩트,31,"['자연스러운', '촉촉한', '추천템']",0,4,"모공,트러블",중성,4,2017-09-07,"확실히 일반 팩트보다 커서 한번에 팡! 하면 넓은 면적에 바를 수 있으니까 좋아요! 21호인데도 많이 밝지 않아서 자연스러운 색으로 피부에 착, 잘 어울립니당! 커버력은 몇번 두드리면 미세한 잡티들은 거의 안 보이구요~ 에센스가 많은편이라서 기름지게 광이나는게 아니구 촉촉해보이게 광이나요! 😆 
근데 진짜 너무 크니까 휴대성은 좀 떨어지구요ㅠㅠ 제형이 말랑거려서 그런가 힘을 주면 팩트에 구멍이 뿅 😭 그래서 저는 집에서 화장하구 나갈 때 베이스로 하니까 좋더라구요~ #자연스러운 #촉촉한 #추천템 "
라끄베르,19758953,스노우 에센스 빅팩트,26,"['커버력좋은', '자연스러운', '촉촉한', '인생템', '추천템']",0,0,"모공,트러블,피지과다",지성,4,2017-09-07,솔직히 빅팩트가 커봤자 뭐 얼마나 크겠어 했는데... 헐 대박 완전 리얼 제가 생각했던거랑은 다르게 정말 크더라구요!! 거울이 큼직큼직하고 퍼프도 큼직큼직!! 무엇보다도 에센스 팩트라서 그런지 촉촉하게 발리는 느낌이 좋았어요! 커버력을 볼려고 Hi는 쫌 진하게 :)는 연하게 그려봤는데 이정도 커버력이면 자연스러운 화장에는 괜찮을 것 같다는 생각이 들어요!!! #커버력좋은 #자연스러운 #촉촉한 #인생템 #추천템 #추천템 #추천템 #추천템 
라끄베르,19758953,스노우 에센스 빅팩트,31,"['커버력좋은', '자연스러운', '추천템']",0,2,"모공,주름,민감성",건성,4,2017-09-06,"고체파운데이션 밤타입 팩트임에도 불구하고 에센스덕분인지 부드럽고 촉촉하게 발림.
보통 이런 밤타입은 밀듯이 바르는데 이건 두드려야 더 피부표현이 더 좋음.
피부색상이 21호가 안맞음에도 불구하고 얇게발리는 느낌이라 자연스런 톤업효과가 있음.
퍼프가 엄청 커서 좋긴한데 너무커서 두드릴 때 흘러내림. 쿠션이라야 전체적으로 찍고 팡팡 두드리면 맛이 날텐데 밤타입이라 조금씩 뭍히고 사용하다보니 정작 퍼프의 1/4부분밖에 활용안함.
거울이 커서 시원시원하게 잘보임. #커버력좋은 #자연스러운 #추천템 "
라끄베르,19758953,스노우 에센스 빅팩트,28,"['촉촉한', '대왕팩트', '커버력좋은']",0,2,"건조함,피부톤,피지과다",복합성,4,2017-09-06,대왕팩트 좋습니다. 큰 것만이 메리트가 아니고 정말 미끄러지듯 에센스가 듬뿍 들어있어 촉촉한 피부표현이 가능하고 뜨지 않고 피부에 착붙이예요. 그리고 팩트가 얼굴피부에 닿는 순간 쿨링감이 있어서 피부가 붉게 올라오신 분들께 더욱더 좋을 것 같아용. 또 큰 팩트가 몇번 안 두드려도 얼굴 전체에 도포할 수 있어 피부에 자극도 많이 안 주고 좋습니다. 전체적으로 만족합니다!!! #촉촉한 #대왕팩트 # #커버력좋은 
라끄베르,19758953,스노우 에센스 빅팩트,22,"['촉촉한', '자연스러운']",0,2,"모공,트러블,피지과다",지성,3,2017-09-05,대왕팩트라고 해서 얼마나 크길래라는 생각을 많이 했는데 진짜 크네요!! 거울크기보고 놀랬어요 대왕팩트답게 퍼프가 커서 양 조절이 저는 안되서 작은퍼프로 발랐어요 지성피부이고 여드름피부인 저에게는  커버력을 중요시 하게 여기는데 커버력은 별로 없는거 같아요 그렇지만 촉촉해요 평소에는  컨실러로 가리는데 컨실러 사용을 안했습니다! 지속력은 잘 모르겠어요 #촉촉한 #자연스러운 
라끄베르,19758953,스노우 에센스 빅팩트,39,"['자연스러운', '촉촉한', '추천템']",0,2,"주름,잡티,건조함",건성,4,2017-09-04,"허걱 내용이 다 날아갔네요 ㅠㅠ
다시 남겨볼게요-

- 우선 처음 받고 크기에 놀랐어요. 넘 커서 휴대는 불편할거 같고 퍼프도 커서 손이 작은 저에게는 불편했어요.
- 사실 저는 팩트보다 쿠션을 선호하는 편인데 요 제품은 좋더라구요. 촉촉하고 은은하게 광이 나서 피부표현이 이쁘게 되요.
근데 에센스가 테두리에 둘러져 있는데 그냥 전체적으로 해줬으면 사용하기가 더 편했을거 같아요.
- 아쉬운 점은 지속력과 커버력이에요. 아무래도 촉촉한 타입이라 그런거같아요

건성이신 분들께 추천해요. 

#자연스러운 #촉촉한 #추천템"
라끄베르,19758953,스노우 에센스 빅팩트,23,"['자연스러운', '촉촉한', '커버력좋은']",0,2,"모공,주름,민감성",복합성,4,2017-09-02,자연스럽게 커버되서 너무 좋은것 같아요! 건성인데 수분감이 많아서 들뜨지 않게 피부 표현되서 추천 #자연스러운 #촉촉한 #커버력좋은 
라끄베르,19758953,스노우 에센스 빅팩트, ,"['대왕팩트', '촉촉한', '왕거울팩트', '피부예뻐보임', '인생템', '무조건강추템']",0,2, , ,5,2017-08-29,"일단 내 인생템으로 등극!!
지금까지쓰던 쿠션팩트와는 너무도다른
빅사이즈에 가방에 가지고 댕겨도 흘러내릴 걱정없고
무엇보다 화장이 무지 잘먹는다는😍
악건성인 내피부에 잘먹는다는건
왠만한 사람들에게 다 잘맞는 제품일듯~
거울도 빅사이즈라 외출해서도 수정화장하기
넘나편하다는~~♡
에센스가 66%함유된 제품이라 촉촉해서
요번 겨울철 데일리팩트로 당첨!!
향기까지 은은하게 좋음~😚

#대왕팩트#촉촉한#왕거울팩트#피부예뻐보임#인생템#무조건강추템"
라끄베르,19758953,스노우 에센스 빅팩트,22,"['라끄베르', '스노우에센스빅팩트', '대왕팩트', '쿨링감', '팩트추천', '촉촉함', '고수분팩트', '스노우앰플']",0,2,"각질,건조함,민감성",건성,5,2017-08-29,"용량,넓은 거울, 넓은 퍼프 모두 2배는!
라끄베르 스노우 에센스빅팩트!🖒
일반팩트는 용량이 평균 12g~15g이라면 대왕팩트는 25g으로 압도적 용량이에요. 타 팩트 크기를 비교해 보니 대왕팩트 인정! 퍼프는 손가락 4개 들어갈 정도로 넉넉해서 몇번만 두드려도 커버 끝! 거울도 일반팩트보다 2배커서 얼굴전체가 보여서 너무 좋아요~ 66%의 스노우 앰플 에센스가 함유되어 있어서 촘촘하게 맺히는 고수분 팩트로 촉촉함과 쿨링감이 더해졌어요!
#라끄베르 #스노우에센스빅팩트 #대왕팩트#쿨링감 #팩트추천 #촉촉함 #고수분팩트 #스노우앰플"
브이티 코스메틱,26930415,블랙 콜라겐 팩트,29,"['간편한', '여행용', '휴대용', '콜라겐', '발림성', '촉촉한', '자외선차단', '피부가좋아보이는']",0,0,"모공,잡티,트러블",복합성,4,2018-03-12,"#간편한 제품이라서 #여행용 #휴대용 으로 너무 좋아요! #콜라겐 성분이 들어가 있어서 #발림성 도 좋았고 #촉촉한 제품이라서 건조할 때 사용하기에 딱인듯 해요.
다만 저는 많이 밝은 피부인데 제품색상이 21호랑 23호 뿐이라서 21호를 구매했더니 제 피부에 좀 어두웠어요. 그 부분이 너무 아쉬웠어요. 색상만 맞으면 정말 편하게 데일리로 바를 수 있는 제품이라 재구매를 하고 싶었는데ㅠ그래도 #자외선차단 도 잘되고 다양한 기능이 있다보니 사용하기 좋은 제품 같아요.
바르면 피부에서 은은한 광이 나서 #피부가좋아보이는 제품이거든요ㅎㅎ"
브이티 코스메틱,26930415,블랙 콜라겐 팩트,28,"['커버력좋은', '촉촉한', '인생템', '추천템']",1,0,"모공,잡티,트러블",건성,5,2018-03-08,"트러블 많고 잡티가 많아서 커버력이 좋은 제품을 
좋아하는 편인데 요 제품이 딱이더라구요✔️
건조한 편이라 매트한 팩트도 못쓰는데 
요건 바르고 나면 광이나요 ✔️
요  팩트 덕분에  피부 좋아 진것 같다는소리 많이 들었어요👍🏻 

#커버력좋은 #촉촉한 #인생템 #추천템 "
브이티 코스메틱,26930415,블랙 콜라겐 팩트,33,"['지속력좋은', '커버력좋은', '자연스러운', '추천템', '건성피부', '윤광메이크업', '보습력좋은', '베이스']",0,0,"건조함,민감성",건성,5,2018-03-08,"건성피부이 좋은 쿠션이에요.
콜라겐 앰플과 파운데이션이 믹스돼서 자연스러운 광도 내주고요. 촉촉해요. 하지만 보습력있는 제품이다보니 머리카락이 붙어요. #지속력좋은 #커버력좋은 #자연스러운 #추천템 #건성피부 #윤광메이크업 #보습력좋은 #베이스"
브이티 코스메틱,26930415,블랙 콜라겐 팩트,36,[],0,0,"모공,주름,잡티",건성,1,2018-01-09,커버력은 옅은 잡티는 잘 커버되고 진한 잡티는 컨실러 사용 후 커버했더니 자연스러웠어요. 에스티로더 파운데이션 사용해 보신 분들은 아실테지만 얼굴에 바르고 난 뒤 약간 건조해지는(굳는?)현상이 있어요. 보송보송해진다고 표현을 하던데 저는 그냥 건조하더라구요. 번들거림이 싫고 파우더팩트로 마무리 해주시는 분들에게 좋은 제품이 아닐까 싶어요.  좀 많이 두껍고 들뜸도 있어요. 추천은 안드립니다.
브이티 코스메틱,26930415,블랙 콜라겐 팩트,24,"['지속력좋은', '자연스러운', '촉촉한', '추천템']",0,3,"모공,잡티,민감성",지성,4,2018-02-27,"#지속력좋은 #자연스러운 #촉촉한 #추천템
브이티에서 콜라겐 팩트 잘 나오는 건 알았지만 리미티드 에디션으로 블랙 콜라겐 팩트 나왔는데
이제야 써 봤네요 ㅎㅎ :-) 홈쇼핑에서 많이 나오길래 인기 많은 건 알았지만
직접 써보니 겨울에 쓰기에 촉촉하니 좋고 커버력은 좀 떨어져서 트러블 같은 건 컨실러로 가려야 하지만 따로 광채 베이스나 요런 걸 바르지 않아도 광채가 자연스럽게 나서 좋아요 
가볍게 피부 화장 하고 싶을 때 손이 갈 것 같아요 
사진 찍을 때도 광채 뿜뿜하면서 인생 셀카 만들어 줍니다 짱
커버력 약해서 별 네개!"
브이티 코스메틱,26930415,블랙 콜라겐 팩트,39,[],1,1,"주름,잡티,건조함",중성,4,2018-01-31,"촉촉한 타입의 에센스밤 타입 팩트 원하는 분들께는 좋을 듯 해요. 다만 세미매트 제형 좋아하시는 분들은 번들거리게 느껴지실 수 있어요. 하지만 겨울철에 피부 보호 하시려면 안티에이징 기능 있는 콜라겐팩트 사용하세요~!! 저도 번들거리는 느낌 싫지만 요즘 건조해서 요아이 사용 중인데, 피부 손상을 막아 주는 듯 해요. 21호, 23호 다 구매해서 23호는 엄마 드렸는데, 엄마도 대만족이시네요. 엄마선물로도 제격이에요~!!!

23호가 생각보다 칙칙하지 않고 내추럴한 느낌이네요. 윤광이 나는 팩트라 그런지~!! 구매시 참고하세요~!!"
브이티 코스메틱,26930415,블랙 콜라겐 팩트,39,[],1,0,"주름,잡티,건조함",중성,4,2018-01-31,"촉촉한 타입의 에센스밤 타입 팩트 원하는 분들께는 좋을 듯 해요. 다만 세미매트 제형 좋아하시는 분들은 번들거리게 느껴지실 수 있어요. 하지만 겨울철에 피부 보호 하시려면 안티에이징 기능 있는 콜라겐팩트 사용하세요~!! 저도 번들거리는 느낌 싫지만 요즘 건조해서 요아이 사용 중인데, 피부 손상을 막아 주는 듯 해요. 21호, 23호 다 구매해서 23호는 엄마 드렸는데, 엄마도 대만족이시네요. 엄마선물로도 제격이에요~!!!"
브이티 코스메틱,26930415,블랙 콜라겐 팩트,28,[],0,1,"건조함,피부톤",건성,3,2018-01-31,"일단 베이지 케이스 패키지가 예뻐서 구매 한건데
실물은 그저 그랬어요ㅠㅠ

1.제품으로 보자면 색상은 참 예쁘게 나온거 같아요
2.첫 화장했을때 윤광이 돌면서 피부가 예쁘게 표현되요
3.타 쿠션에 비해 다크닝이 없는 편이에요

이러한 리뷰들을 보고 구매 하였으나...

1. 화장이 잘 지워지는편이에요. 손만 닿아도 자국이 ㅠㅠ
2. 첫화장시엔 예쁜데 ...수정화장하면 진짜 바로 떠요
제가 잘 뜨는 편이 아닌데요 이제품만 사용하면 항상 떠요 ㅠㅠ

이 두가지 단점때문에 저는 손이 잘 안가네용.."
브이티 코스메틱,26930415,블랙 콜라겐 팩트,43,[],0,0,"모공,주름,민감성",복합성,5,2018-01-30,"인생팩트니 해서 너무 인기가 많아서 저도 개인적으로 너무 궁금한 제품이었어요
개봉했을때 에센스 비중이 많아서 촉촉하겠지만 커버는 떨어지는거 아닐까 걱정했었는데
커버도 훌륭하고 바를때 느낌이 너무 좋더라구요
민감한 홍조피부인데도 자극은 전혀 없고 최근 추운야외에서 오랬동안 
있었는데도 건조해지지 않아 놀랐어요
보통 겨울에는 팩트바르면 금방 건조해서 푸석푸석해지는데
VT블랙 콜라겐팩트는 처음 바른그대로 계속 유지가 되더라구요 피부가 좋아보인다는
말도 들었어요 인가 많은 이유가 있더라구요"
브이티 코스메틱,26930415,블랙 콜라겐 팩트,35,"['커버력좋은', '자연스러운', '촉촉한', '추천템']",0,0,"잡티,건조함,피부톤",건성,4,2018-01-25,"#커버력좋은 #자연스러운 #촉촉한 #추천템 
보통 21호 피부에 너무 밝지도 어둡지도 않은 자연스러운 컬러라 목이랑 경계지지 않네요. 약간 핑크빛이 도는 베이지입니다. 커버력도 좋은편이라 웬만한 잡티는 커버가 잘됩니다. 메이크업 직후에 광이 나는게 마음에 들었는데 서너시간지나니 광이 약해져서 조금 아쉽습니다.ㅠㅠ 하지만 지속력도 좋은편이고 촉촉해서 피부가 당기지않아 겨울팩트로 좋아요."
브이티 코스메틱,26930415,블랙 콜라겐 팩트,34,[],0,0,"모공,잡티,피지과다",지성,5,2018-01-23,"VT 블랙 콜라겐 팩트는 블랙콜라겐성분이 10,000ppm  들어있는 제품으로 피부진정과 영양공급에 도움을 주는 성분들(마카뿌리추출물, 하얀루핀씨추출물, 삼나무잎추출물)을 함유하여 광채나는 피부 연출 뿐만 아니라 피부 건강까지 케어해줘요"
브이티 코스메틱,26930415,블랙 콜라겐 팩트,35,"['커버력좋은', '촉촉한', '인생템', '추천템']",1,0,"모공,건조함,피부톤",건성,4,2018-01-11,"건조한 피부에 안성맞춤인듯 해요..
콜라게에센스와 파운데이션의 황금 비율 마블로
촉촉한 피부표현 가능!!
수분감이 리얼,베리보다 더 높아요..
발색은 리얼 21,23호랑 비교해봤어요..
리얼 21호다 아주 쬐금 더 밝은 듯 해요!!
#커버력좋은 #촉촉한 #인생템 #추천템"
브이티 코스메틱,26930415,블랙 콜라겐 팩트,33,"['자연스러운', '추천템', '지속력좋은']",0,0,"모공,주름,건조함",복합성,4,2018-01-05,"반트 콜라겐팩트 블루, 베리를 써보고 좋아서 블랙도 구매하게 됐어요 커버는 블루가 더 높았고 윤기는 베리가 높았어요 블랙은 중간타입으로 적당하게 쓰기 좋은 거 같아요 #자연스러운 #추천템 #지속력좋은 "
브이티 코스메틱,26930415,블랙 콜라겐 팩트,21,[],0,1,"모공,트러블,피지과다",지성,4,2018-01-02,"<블랙 콜라겐 팩트> 
저 같은 수분부족형지성인 분들에게 추천합니다 !
밤형태라서 기대는 별로 안했는데 , 생각보다 커버도 잘 되고 
촉촉하더라구요 !! 무너짐도 별로 없고 밀착력도 굿 ෆ

* 다만 기초는 초크초크하게 해 준 상태에서 사용해야 할 것 같아요 , 피부에 올릴 때는 내장된 퍼프보다는 손가락으로 문질문질 해서 올려주는게 에센스가 많이 묻어나와서 촉촉해져요 ! 그 후에 퍼프로 두들두들겨주시면 예쁘게 피부표현 가능합니다 !!!!"
브이티 코스메틱,26930415,블랙 콜라겐 팩트,36,"['지속력', '커버력좋은쿠션', '인생템', '추천템']",1,1,"잡티,피부톤",복합성,5,2017-12-25,"미백, 주름개선, 자외선 차단3중 기능성 화장품으로 우수한 커버력과 들뜸없이 메이크업이 가능해서 너무 좋았어요. 개인적으로 콜라겐팩트에 대한 만족감이 굉장히 컸던 제품이고 역시나 브이티콜라겐팩트 
촉촉하고 영양감까지 제대로 느껴서 좋았습니다~ 커버력은 기본이구요!!!

#지속력 좋은 #커버력좋은쿠션 #인생템 #추천템"
브이티 코스메틱,26930415,블랙 콜라겐 팩트,28,"['자연스러운', '촉촉한']",0,1,"모공,각질,트러블",지성,4,2017-12-20,"촉촉해서 겨울에도 들뜸없이 살짝 광이 돌게끔 발라져요.
무엇보다도 각질이 부각이 안되고 피부톤을 잘 정돈해줘서 괜찮았어요! #자연스러운 #촉촉한 "
브이티 코스메틱,26930415,블랙 콜라겐 팩트,29,"['쿠션', '윤광']",0,0,"모공,건조함,피부톤",건성,4,2017-12-20,"날이 추워서 그런지 막 녹아들듯 섞이지는 않구요 
쿠션팩트에서 볼 수 없는 윤기가 흐르는 광이 VT 콜라겐팩트의 가장 큰 장점인 것 같아요 ~ 
눈에 보이는 광에 비해 잔여감도 거의 없어서 지속력도 정말 좋겠더라구요
눈에 띄는 잡티가 있는 제 피부에서는 커버력이 그렇게 좋다고 할 순 없었지만 
자연스러울 정도의 커버력이 있어 마음에 들었습니다 :-)
블랙 에센스 덕분에 보습감이 더 있어서 건조한 겨울에도 들뜸없이 사용하기 좋았어요 ! #쿠션 #윤광"
브이티 코스메틱,26930415,블랙 콜라겐 팩트,41,[],1,0,"주름,민감성,트러블",복합성,4,2017-12-19,평소 메이크업후 건조해 피부속 당김이 있어 눈밑 주름이 잡히곤 했는데 VT는 촉촉함+지속력+자연스러움 세가지 모두를 충전시켜주어 메이크업후에도 속당김이 없어 너무 좋아요^^♡자연스럽게 광채도 돌아 예쁨~촉촉한 가을 메이크업을 원하신다면 적극 추천해드려요!!!
