brandname,pid,pname,age,tags,repurchased,like_c,concern_list,skin_type,score,date,text
로레알파리,7429194,트루 매치 파운데이션,30,"['파데', '추천템']",0,1,"주름,건조함",건성,4,2017-04-06,촉촉하고 얇게발려요^^  아이보리컬러고 살짝 21호보다는 밝은 느낌이에요~~ 자연스러운 피부표현이 좋고 커버력은 보통! 지속력은 그렇게 높지는않아요^^ 건조하지않고 얇게발려서 더블웨어랑 섞어써도 괜찮더라구용! 가격도 저렴해서 추천~~~#파데#추천템
스킨푸드,29721,청포도 프레시 파운데이션,30,"['지속력좋은', '자연스러운']",1,0,잡티,복합성,5,2018-05-03,"짱좋아용!!! 보통 21호쓰시는분들은 13호 사시면 됩니다 ㅎㅎ
자연스러운데 톤 밝혀주고 지속력도 좋네여 ㅎㅎ
추천합니다! #지속력좋은 #자연스러운 "
스킨푸드,29721,청포도 프레시 파운데이션,22,"['보송', '지성추천템', '스킨푸드']",0,0,"잡티,트러블",복합성,3,2018-03-30,인터넷에서 되게 싸기 팔길래 테스트도 안하고 사본 제품이에요.. 그래서 그런지 건조한지 모르고 샀다가 피부 뒤집어졌어요... 이거 바르고 애들 만났는데 애들이 떴다고... 각질일었나다고 그러더라구요ㅠㅠ 건성은 비추템 입니다!  그리고 짤때 기름...? 같은게 나오더라구요...ㅠ 이거 보다 청포도 프레쉬 베이스 민트! 그거 추천드려요... 친구가 그거 있는데 되게 로션처럼 발리구 좋더라구요... #보송 #지성추천템 #스킨푸드
스킨푸드,29721,청포도 프레시 파운데이션,20,[],0,0,"각질,건조함,트러블",건성,5,2018-02-09,"파운데이션 중에  이게 딱  좋은거  같이요
촉촉하고 부드럽고  건성인 분한테 추천합니다
한번  써보세요   엄청  좋습니다
아마  다 쓰면 재구매 할  정도로  젛아요
앞으로  파운데이션는 스킨푸드에서사는걸로 ㅎㅎ"
스킨푸드,29721,청포도 프레시 파운데이션,27,[],0,0,"건조함,민감성,트러블",건성,2,2018-01-30,"음..남자들이 애용한다는 파데ㅋㅋㅋㅋ
남자친구가 삿길래 저도 발라봣는데 저는 악건성이라 너무 건조하고 두꺼운느낌에 들떠서 별로엿어요ㅜ
그리고 이제품 정말 어둡게나와서 발랏다가 당황ㅋㅋㅋㅋ
13호가 일반 21호랑 비슷하거나 쪼~~금더 어두운듯하니 이제품 사시려면 꼭 테스터가 필요할듯ㅎ.."
스킨푸드,29721,청포도 프레시 파운데이션,23,"['지속력좋은', '자연스러운', '인생템', '추천템', '건성']",1,1,"잡티,건조함,민감성",건성,5,2018-01-30,"쓰고 재구매해서 두번째로 쓰는 파운데이션이에요! #지속력좋은 #자연스러운 #인생템 #추천템 #건성
저는 유분부족형 건성인데 봄~여름에는 너무 촉촉한 파데를 바르면 얼굴이 흘러내리는 기분(!)이라 조금 커버력 있는 템을 찾았고 이게 그거에요! 가격대비 (세일할땐 6000원대) 커버력도 나쁘지않고 촉촉하게 발리지만 끝마무리가 세범바른것처럼 보송보송해서 (이 점이 제일 맘에 듭니다)
봄부터 겨울오기전에 알차게 한통 비웁니다!
21호쓰시는 분들은 13호쓰시는게 적당합니다"
스킨푸드,29721,청포도 프레시 파운데이션,16,[],0,0,"각질,피부톤,트러블",복합성,4,2018-01-15,커버력은 일단 별로에요 솔직히 그런데 얇게 부담스럽지 않게 올라가고 색이 많이 어둡게 나와서 23호이신분들도 13호가 화사하게 맞을것같네요
스킨푸드,29721,청포도 프레시 파운데이션,17,[],1,0,"모공,각질,트러블",지성,5,2018-01-12,"일단 가격이 매우 저렴하고 로드샵 파데들 중 상위권에 속한다고 생각합니다.
커버력도 없진 않고 집 앞 나갈 때는 요거 하나 쓱쓱 바르고 나가기에 매우 좋아요.
이거 왜 안 사시나요ㅠㅠ 내일까지 세일하는데 어서 구매해오세요! 호수는 조금 어둡게 나와서 저 23호피부인데 21호 샀는데 좋아용"
스킨푸드,29721,청포도 프레시 파운데이션,20,"['자연스러운', '추천템']",0,0,"잡티,건조함,민감성",복합성,3,2017-12-19,이가격에 이퀄리티는 진짜인정해야됨 애들말듣고 반신반의상태로 구매핬는데 봄 에서 여름지나갈때 쓰기너무좋은 파데였움 자연스럽고 얇게 피부표현되서 먼가 더이뻐보이고싶은날앤 컨실러로 하이라이터해줌 써보고싶은사람들은 한번쯤은 써봐도될 파데 #자연스러운 #추천템 
스킨푸드,29721,청포도 프레시 파운데이션,24,[],0,0,"모공,각질",지성,5,2017-12-17,조르지오는 장시간 화장해야될때 쓴다면 이건 짧게 화장해도 되는날씁니다. 약간의 모공끼임이있으나 보송한마무리로 저같은 지성이좋아할만합니다.솔직히 무너짐도 나쁘지 않습니다. 가성비 대비 파운데이션 얘 따라올자 없는거같아요.  21호쓰는여잔데 스킨푸드는 13호씁니다. 참고하세요!!
스킨푸드,29721,청포도 프레시 파운데이션,18,"['인생템', '자연스러운', '추천템', '학생파운데이션']",1,0,"피부톤,트러블",지성,5,2017-12-08,"제 피부가 23호인데여 어둡게 나와서 진짜 자연스럽고 지속성도 괜찮고... 손이 많이 가는 제품♥♥ 그리고 커버력이 많이 있는게 아니라서 자연스러움
#인생템 #자연스러운 #추천템 #학생파운데이션"
스킨푸드,29721,청포도 프레시 파운데이션,23,['비추템'],0,0,"피부톤,트러블",지성,2,2017-12-08,"#비추템 

원래23호 피부인데 직원분이 어둡게 나왔다고 해서 21호로 구매했습니다.
워낙 저렴한데 커버력도 좋은 파데로 유명해서 기대했던것 때문인지 정말 실망했습니다.

바를 때 파데보단 비비 크림 같은 느낌이었고 커버력도 좋은편은 아니라고 생각됩니다. 만약 구매하실 의향이 있으신다면 기대하지말고 세일할 때 저렴한 가격에 구매해서 사용하세요! 제가 기대감이 높아 실망감이 더 큰 것 같네요. 재구매의사는 없습니다!"
스킨푸드,29721,청포도 프레시 파운데이션,24,[],0,0,트러블,지성,4,2017-12-05,지성피부를 위한 저렴이 파데중에선 괜찮은 제품인거 같아요! 처음엔 완전 매트한 파데라고 예상했는데 조금 촉촉한 제품이구요 피부위에 올리면 파우더리하게 마무리되어요! 다만 커버력은 좀 떨어지는게 잇어요 요즘엔 다른 파데도 좋은게 많아서 굳이 이걸써야한다는건 없지만 그래도 나쁘지 않은 제품인듯합니당 근데 코에 각질이 일어낫을때 바르니까 각질부각 쩔어요 꼭 각질케어하고 수분채우고 발라주세용
스킨푸드,29721,청포도 프레시 파운데이션,17,"['지속력좋은', '커버력좋은', '자연스러운', '촉촉한', '인생템', '추천템']",1,0,"잡티,건조함,트러블",건성,4,2017-10-27,촉촉하고 커버력도 좋으면서 지속력이 진짜 갑이예요 가성비가 진짜 대박이구요 지금 5통사서 쟁겨놓고 쓰고 잇어요!! #지속력좋은 #지속력좋은 #커버력좋은 #자연스러운 #촉촉한 #인생템 #추천템 
스킨푸드,29721,청포도 프레시 파운데이션,21,[],0,0,"모공,피부톤,피지과다",복합성,2,2017-11-29,좀 어두워요 색이.. 글고 지속력도 좋은편은 아닙니다 몇시간 있으면 쌩얼수준으로됐었어여 저는ㅠ 피부 좋으신 분들 쓰면 딱 자연스럽고 좋을 제품이에요
스킨푸드,29721,청포도 프레시 파운데이션,23,"['지속력좋은', '자연스러운', '촉촉한', '인생템']",1,0,"모공,아토피",복합성,4,2017-10-27,23호 쓰는데 이건 어둡게 나온거라 그래서 21호 쓰는데 딱 제 피부톤 저렴한데 좋다해서 기대없이 샀는데 좋았어요! 원래 비쉬비비썼는데 스킨푸드 할인할때 사면  가격차읻ㄷㄷ 개이득 #지속력좋은 #자연스러운 #촉촉한 #인생템
스킨푸드,29721,청포도 프레시 파운데이션,24,"['지성', '추천', '얇음', '뽀송뽀송']",0,0,"각질,건조함",건성,4,2017-10-24,"#지성 #추천 #얇음 #뽀송뽀송 
건성이 저에게는 조금 많이 건조 했어요 마무리감이 세미매트 해지면서 여름에 피지분비 많을때는 잘썻지만 겨울에는 건조하더라구요 조금 지성이신분들에게 추천하구요 커버려은 많이 없기때믄레 피부좋으신 분들에게더더욱 예쁜 피부표현이 될꺼같아요"
스킨푸드,29721,청포도 프레시 파운데이션,17,"['스킨푸드', '파운데이션', '청포도프레시파운데이션', '베이스', '화장', '애정탬', '지속력좋은', '추천템', '촉촉한', '자연스러운']",1,3,"건조함,민감성,피지과다",복합성,5,2017-09-21,"#스킨푸드 #파운데이션 #청포도프레시파운데이션 #베이스 #화장 #애정탬 #지속력좋은 #추천템 #촉촉한 #자연스러운

전 얼마전에 친구에게 선물을 받아서 알게됬어요. 
처음 딱 썻는데 발림성도 좋고 제 피부에 딱이었어요~!
그리고 내추럴 베이지여서 잠깐 집 나갈 일이 있거나 남친이 갑자기 와서 급할 때도 한듯 안한듯  그래서 좋은것같아요~
피부가 민감하면 쓰기 좀 불편할 수도 있을것같습니다^^  근데 커버에서는 적당하게 가릴건 가려주어서 한듯 안한듯해요!!!
자연스러운 메이크업을 원하시는 분들에게 추천드리고 싶어요~~ㅎ"
스킨푸드,29721,청포도 프레시 파운데이션,22,['비추템'],0,0,피부톤,중성,1,2017-09-21,음 제 인생 최악의 파운데이션이라면 이 친구가 아닐까요ㅋㅋㅋㅋㅋㅋㅋㅋ 진짜 처음 바를땐 색도 맘에 들고 매끈한 피부로 표현되길래 오오오오 이러고 있었는데 오후 되니까 완전 안예쁘게 무너지고 코끼임 완전 쩔고 그래서 엄청 별로였어요ㅠㅠ 미백크림에 섞어쓰니까 좀 나았지만 10번도 사용안하고 방구석으로 아웃.. #비추템 
스킨푸드,29721,청포도 프레시 파운데이션,24,"['무난템', '모든게그저그럼', '청포도향기', '모공커버력거의없음', '한톤밝은것추천']",0,1,"모공,건조함",복합성,3,2017-09-03,"향기가 정말 강해요ㅋㅋㅋ 청포도 향이 팡팡 터집니다ㅋㅋㅋㅋ 지속력도 무난 커버력도 무난한데 모공커버를 원하시는 분들에게는 비추합니다. 그리고 촉촉보다는 매트에 가까워요. 다른 파데들보다 좀 어둡게 나와서 원래 21호 쓰시는 분들은 13호 쓰시는게 좋아요.노란끼가 도는편이라 홍조나 붉은기있는 피부이신 분들께 좋을것같아요.
#무난템 #모든게그저그럼 #청포도향기 #모공커버력거의없음 #한톤밝은것추천"
스킨푸드,29721,청포도 프레시 파운데이션,17,"['추천탬', '자연스러운', '스킨푸드', '청포도']",1,2,"모공,각질,피부톤",복합성,3,2017-07-28,"제가  수분부족형 지성인데 사용하기 엄청엄청 좋아요 !!
어느정도 뽀송하면서 촉촉해서 저같은 피부타입분들은 좋을꺼같아요. 그라고 약간 쫌 노란감이없지않아서 저는 보라색 메이크업베이스랑 섞어서 사용해주고있습니다. 누구나 한번쯤은 서용해보시묜 좋을꺼같아요. 저는 지금 2통째쓰고있고 호수마다 있어요. 색상도 엄청자연스럽고 커버도 짱짱입니다!! 
#추천탬 #자연스러운 #스킨푸드 #청포도"
스킨푸드,29721,청포도 프레시 파운데이션,23,"['밀착력좋은', '커버력좋은', '무너짐예쁜', '피부표현예쁜', '지성피부추천', '보송한', '추천템', '가성비짱']",0,3,,복합성,5,2017-07-26,"진짜 저 처음 청포도파운데이션 사용해보고 깜짝 놀랐어요!
진짜 피부표현이 제 최애 파운데이션인 아르마니와 너무 비슷하게 되어서 감탄했던 제품이에요😍😍
아무래도 아르마니의 최대장점인 무너짐을 따라가진 못하지만 첫 피부표현이 느낌이 굉장히 비슷하더라구요!
그정도로 피부표현이 정말 예쁘고 밀착력이 굉장히 좋아요👍👍
커버력도 중상정도 되는것같고, 무너짐도 예뻤어요~!
웬만한 로드샵의 2,3만원 파운데이션들보다 만족스러웠어요\( ¨̮ )/

#밀착력좋은 #커버력좋은 #무너짐예쁜 #피부표현예쁜 #지성피부추천 #보송한 #추천템 #가성비짱"
스킨푸드,29721,청포도 프레시 파운데이션,15,['자연스러운'],0,1,"각질,피부톤,피지과다",지성,3,2017-05-14,피부톤 색상이 어두운건 아닌데 피부톤이 좀 노래서 평소에 21호정도  쓰는데 노란색베이스가 싫어서 21호로 안사고 13호로 샀거든요. 근데도 많이는 안 밝아요. 지속력도 괜찮고 다크닝이 있는데 그것 빼고는 괜찮아요. 그리고 커버력은 거의 없고 가볍고 얇게 발려서 바르듯 안바른듯 자연스럽고 약간 촉촉한 과의 파데여서 피부표현도 이뻐요. 그리고  특히 가격이 저렴해서 학생들이 쓰기 괜찮을 것 같아요. #자연스러운
스킨푸드,29721,청포도 프레시 파운데이션,23,"['자연스러운', '촉촉한', '비추템']",0,1,"모공,트러블,피지과다",지성,3,2017-03-11,로드샵 파데 중 유명하죠~ 우선 색상이 엄청 어둡게나와서 평소 21호 쓰는 제게도 13호가 하나도 밝지 않았어요 딱 제 피부색에서 아주약간만 화사하게? 발림성도 좋았는데 지속력이 좀 아쉬워서 재구매의사는 없어요 참고로 저는 파워지성이랍니다 #자연스러운 #촉촉한 #비추템 
스킨푸드,29721,청포도 프레시 파운데이션,24,"['리즈갱신', '자연스러운', '촉촉한', '추천템']",0,1,"주름,잡티,건조함",중성,4,2017-02-07,가격대비 괜찮아요~ 손으로 바르는게 더 좋은듯해요.원래 피부가 밝은편이라 13호 사용했는데 피부색이랑도 잘 맞네요.다만 조금 아쉬운 점이 있다면 커버력이 좀 부족해요~그래서 저는 컨실러도 같이 사용합니다~ #리즈갱신 #리즈갱신 #자연스러운 #촉촉한 #추천템 
스킨푸드,29721,청포도 프레시 파운데이션,21,"['자연스러운', '추천템', '뷰티템연말정산']",1,1,"모공,잡티,트러블",지성,5,2017-01-06,"저 같은 10대에게 정말 좋은 제품이예요 그리고 투명한 메이크업을 원하시는분도요 지금 두병째 쓰는중 앞으로도 재구매의사 있어요!!!
#자연스러운 #자연스러운 #추천템 #뷰티템연말정산"
메이블린 뉴욕,4766331,핏 미 파운데이션,27,[],0,3,"각질,건조함,민감성",건성,3,2018-05-11,"사용감, 피부표현, 지속력 모두 좋았습니다. 제가 피부가 얇아서 얼굴에 핏줄이 비치는데 그게 안가려지더라구요ㅠㅠ 마무리가 보송해서 손을 대도 자국이 안남아서 너무 신기했어요! 신기해서 계속 만지게됨ㅋㅋㅋㅋ

다 좋았는데 별 세개를 준건 다크닝 때문입니다. 제가 쿨톤에 가까운 뉴트럴톤 인데요. 112컬러가 제 피부색이랑 진짜 똑같아요!! 근데 시간이 지나면서 파데가 마르면 점점 붉어지더라구요. 그게 너무 별로였어요ㅠ 모공커버도 잘 안되구요. 
사진은 손목에 짠거 - 손목에 바른거 - 시간지나 붉은기 올라오는거 순서입니다"
메이블린 뉴욕,4766331,핏 미 파운데이션,31,"['지속력좋은', '커버력좋은', '촉촉한', '인생템', '추천템']",0,1,"모공,민감성,트러블",복합성,5,2018-05-08,핏미 컨실러 사용하고 너무좋아서 정착했는데 한국에 들어오자마자 달려감. 얼굴을 지우고 메컵했는데 모찌하게 연출되서 바로 질렀어요~ 지속력 커버력도 짱좋아요! 지성피부에도 끄떡없음! #지속력좋은 #커버력좋은 #촉촉한 #인생템 #추천템 
메이블린 뉴욕,4766331,핏 미 파운데이션,25,[],0,1,"모공,잡티,민감성",건성,4,2018-05-07,"매트한 파운데이션으로 여름에 사용하기 좋을 것 같고, 지성피부이신분들에게 추천하고 싶어요! 컬러도 다양하게 있어서 자기 피부에 딱 맞는 호수를 사용할 수 있을 것 같아요! 밀착력이나 커버력도 괜찮아요! 피부를 보송보송하게 해줘서 좋더라구요!"
메이블린 뉴욕,4766331,핏 미 파운데이션,29,[],0,1,"잡티,트러블",복합성,5,2018-05-03,"일단 다양한 색상이 나오는게 정말 맘에 들어요! 21호~23호 사이 피부라 항상 파데 구매하기 애매했는데 이거 쓰면 자연스럽게 피부톤과 잘 어울려서 과한느낌 없이 좋네요. 억지로 톤업한 느낌이 아닌 내 피부톤에 맞게 건강해보여요.
매트하고 보송하게 마무리되는 편이고, 손으로 발라도 무리없이 발리지만 매트한 제형이다보니 좀더 피부 윤기를 유지하고싶을 경우엔 파데브러쉬를 사용하곤 해요.
매트하지만 뜨거나 갈라지는 느낌은 없이, 촉촉한 파데들만큼이나 피부에 잘 밀착돼서 피부표현하기 쉬워요.
너무 건조하지도 않고 유지력과 커버력도 좋은편."
메이블린 뉴욕,4766331,핏 미 파운데이션,21,"['촉촉한', '파데추천', '무너짐예뻐욤']",0,1,"모공,건조함,민감성",복합성,5,2018-05-03,저는 110 포슬린을 사용했어용 밝은21호인데도 좀 밝게 느껴져서  21호분들께는 112를 추천드립니당 허허 촉촉한편인데 무너짐이 굉장히 예쁜편이예요 각질부각이나 속건조도 못느꼈고 자연스러운 광도 나는거같네요 커버력도 나쁘지않아요 그건 사진보면 딱 보이시겠쥬? 코옆끼임도 없었고 저는 굉장히 마음에 들어요 무엇보다 비싸지않은가격이 제일 매력적인거같습니당 요즘은 물먹인 똥퍼프로 이거랑 살짝 매트한거 섞어바르고 있어요 맨.날. #촉촉한 #파데추천 #무너짐예뻐욤
메이블린 뉴욕,4766331,핏 미 파운데이션,28,"['메이블린뉴욕', '핏미파운데이션', '모공파데', '믿고사는핏미']",0,2,"모공,건조함",건성,4,2018-05-02,"건성임에도 불구하고, 기초룰 튼튼하게 해주니까 정말 무너짐이 적더라구요.!
그리구 커버력은 중간정도, 엄청 가벼워서 답답하진 않았습니다!
파데 바르고 롯데월드 다녀왔는데요(더웠음...약 13시간 화장)
거의 무너짐 없고, 모공 끼임도 없었다는 점!!!!
건성 분들에겐 봄,여름에 정말 사용하기 좋을 듯 합니다 ㅎㅎ

#메이블린뉴욕 #핏미파운데이션 #모공파데 #믿고사는핏미"
메이블린 뉴욕,4766331,핏 미 파운데이션,25,"['메이블린파운데이션', '핏미파운데이션', '메이블린', '파운데이션추천', '추천템', '지속력좋은', '커버력좋은', '자연스러운']",0,1,"모공,피부톤,트러블",복합성,4,2018-05-02,"제형이 촉촉한데 마무리가 보송해요.
그렇다고 건조한 느낌도 없고 피부에 밀착감이 좋아요. 
115호 아이보리 사용했는데 살짝 붉은 빛 있는 베이지 컬러에요.
커버력도 괜찮은 편이고 소량만 사용해도 충분해요. 
피부 톤에도 자연스럽게 어울립니다 :)
그리고 오랜 시간 메이크업을 하고 있어도 들뜨지 않고 다크닝도 없어서 요즘 자주 사용하고 있어요! 

#메이블린파운데이션 #핏미파운데이션 #메이블린 #파운데이션추천 #추천템 #지속력좋은 #커버력좋은 #자연스러운"
메이블린 뉴욕,4766331,핏 미 파운데이션,26,"['지속력좋은', '모공커버', '여름파운데이션']",0,1,"잡티,피부톤,트러블",복합성,4,2018-05-02,"여름파운데이션 찾으시는 분들 PICK ME!
당장 올리브영으로 테스트해보러가세요
컬러도 옐로베이스, 핑크베이스 다양하게 나와서 넘나 만족!!
보송보송한 마무리감에, 모공커버,요철커버까지 
여름파데로 추천하는만큼 보송한 마무리감으로 지속력도좋아요
내피지와 유분을 넘나 잘잡아주는 파데에요!
세미매트로 보송한 마무리감이 마음에 드는 파데였어요
▶115번 컬러는 핑크베이스 21호라고 생각하시면될거같아요!
▶너무 건조하다싶으면 기초를 탄탄히 해주세요 그러면 오래 무너지지않는 피부메이컵 완성!
 #지속력좋은  #모공커버 #여름파운데이션"
메이블린 뉴욕,4766331,핏 미 파운데이션,31,"['커버력좋은', '자연스러운', '촉촉한', '추천템']",0,1,"각질,주름,피부톤",복합성,5,2018-05-02,"#커버력좋은 #자연스러운 #촉촉한 
촉촉하고 자연스러워서 얼굴에 밀착 되는 느낌이 너무 좋았어요
아시겠지만 색상이 정말 많아요! 많은 색상들을 섞어서 써도 좋고 한가지만 써도 좋아요
저는 내츄럴 아이보리 색상을 받았는데 자연스럽게 얼굴에 커버가 되더라구요
좀더 밝은 느낌을 원했기에 조금 아쉬운 감이 없지 않아 있지만 내츄럴 아이보리보다 좀 더 밝은 색상도 있으니 안심! 촉촉하게 살짝 - 커버가 되면서 무엇보다 홍조를 자연스럽게 잡아주니 좋아요! 추천합니다^^ #추천템 "
메이블린 뉴욕,4766331,핏 미 파운데이션,24,"['핏미파데', '가벼운파데']",0,4,"모공,건조함,트러블",중성,4,2018-05-02,"자연스러운 21호에서 22호가 사용하기 좋은 컬러에요. 핑크빛 베이스 컬러라서 어두운 피부지만 자연스럽고 건강한 느낌을 줘서 예쁘게 태닝한 듯한 피부를 연출해 줍니다! 무엇보다도 만족스러운 커버력에 엄청 얇은 발림성이라 요즘 무겁지 않은 베이스 메이크업을 원하시는 분들 핏미 파데 사용해 보세요!!
그리고 세미매트라 피지 분비가없는 볼이나 이마쪽에 살짝 건조함이 있는데 멀티밤과 믹스해서 바르고 피지분비가 많은 부위에는 핏미 파데 그대로 발라주면 파우더처리를 하지 않아도 보송하고 촉촉한 메이크업이 유지돼요!
#핏미파데 #가벼운파데"
메이블린 뉴욕,4766331,핏 미 파운데이션, ,"['자연스러운', '추천템', '인생템', '지속력좋은']",1,0, , ,4,2018-05-01,"피부에 트러블이 많은 편이라 항상 커버력 높은 제품만 사용했었는데 너무 답답함을 느껴서 가벼운 파운데이션으로 바꿔보자~ 하고 선택한 파운데이션이에요!! 전혀 기대 없이 사용해 봤는데 너무 가볍고 커버력도 엄청 좋은 정도는 아니지만 그래도 붉은기나 피부 톤 커버 정도는 해주고여 모공커버 짱입니다!! 지속력도 좋아요!! 
다만 단점이 있다면 저는 다크닝을 좀 느꼈어요ㅠㅠ 뭔가 얼굴이 칙칙해진 느낌???
그래서 저는 포슬린 색과 아이보리 색을 섞어 바릅니다! #자연스러운 #추천템 #인생템 #지속력좋은 "
메이블린 뉴욕,4766331,핏 미 파운데이션,27,"['메이블린뉴욕', '핏미파운데이션', '옐로우베이스', '핏미컨실러', '모공파데', '믿고사는핏미']",0,1,"잡티,건조함,민감성",건성,5,2018-05-01,#메이블린뉴욕 #핏미파운데이션 은 묽고 얇은 제형이에요. 110호 포슬린은 #옐로우베이스 밝은 아이보리색으로 예쁘게 나왔어요! 19호~20호 정도 피부톤에게 추천합니다. 커버력은 중간 정도로 홍조나 작은 잡티는 잘 가려주고 제형이 가벼워서 레이어링하면 좋아요. 그리고 #핏미컨실러 와 궁합이 좋으니 같이 사용하시는 걸 추천해요. #모공파데 답게 모공커버가 잘되고 피부결이 정말 예뻐보여요! 저한테는 무너짐도 아주 좋았어요 코는 뭉침없이 약간 사라지고 다른 부분은 무너짐이랄게 없는..? #믿고사는핏미 인정합니다♡
메이블린 뉴욕,4766331,핏 미 파운데이션,26,"['지속력좋은', '커버력좋은', '자연스러운', '인생템', '추천템']",0,1,"모공,각질,트러블",복합성,5,2018-04-30,"메이블린 핏미 파운데이션 포슬린은 제가 정말 좋아하는 예쁜 상아컬러의 파운데이션이였어요~ 잡티커버, 모공커버력이 좋으면서 이렇게 얇고 편하게 발리는 파운데이션은 처음이에요~
저는 지속력도 정말 좋았어요. 모공끼임이 없고 무너짐도 지저분하지 않고 컬러와 커버력, 지속력까지 정말 다 마음에들어요~ 건조함도 없었던 파운데이션입니다. 정말 요즘 매일 사용중인 파운데이션이에요~ 인생템 등극!#지속력좋은 #커버력좋은 #자연스러운 #인생템 #추천템"
메이블린 뉴욕,4766331,핏 미 파운데이션,27,[],0,2,"모공,트러블",복합성,4,2018-04-30,"제가 사용한 색상은 핑크 베이스로 화사한 피부 표현 연출이 가능했어여♡ 많은 분들이 핏미핏미 하셔서 되게 궁금했는데 확시뢰 커버력도 좋고 피부 표현도 예쁘게 되서 좋았는데 115호는 평소에 22호톤을 사용하는 저한테 한톤 밝은 것 같아서 어두운 컬러를 사용해보고 싶더라구요ㅎㅎ
근데 펌핑기를 따로 구입해야 하는게 좀 불편했어요ㅠ"
